"name","post_modified","post_date","byline","alt_text","description","place_name"
"151SPOSUB010_0.jpg","08/20/2014","08/20/2014","Photo Credit: Spokane Regional CVB","Downtown Spokane, WA at Night","Fairchild Air Force Base and Spokane Public Schools top the list of the city's top employers. Find out what else made the list",
"151SPOSUB008_0.jpg","08/20/2014","08/20/2014","Photo by Alan Bisson, courtesy of the Spokane Regional CVB","Downtown Spokane, WA","With its urban landscape and diverse industries, it's no wonder",
"151SPOSUB007_0.jpg","08/20/2014","08/20/2014","Photo courtesy of Flickr user ebis50","Gonzaga University Campus in Spokane, WA","Spokane is home to both Gonzaga University and Whitworth University, as well as plenty of ebis50",
"151SPOSUB006_0.jpg","08/20/2014","08/20/2014","Photo by Ben Tobin, courtesy of the Spokane Regional CVB","Riverfront Park in Downtown Spokane, WA","With over 100 acres of green space in the heart of downtown Spokane, Riverfront Park is an attractive option for",
"151SPOSUB005_1.jpg","08/20/2014","08/20/2014","Photo Credit: Spokane Regional CV","River Park Square in Downtown Spokane, WA","Downtown Spokane offers pedestrian friendly streets and plenty of",
"151OAKSUB006_0.jpg","08/20/2014","08/20/2014","Photo Credit: Pam Headridge","Oak Harbor Marina in WA","Oak Harbor Marina is a major draw for residents and tourists alike. Find out what else","Oak Harbor"
"151OAKSUB007)_0.jpg","08/20/2014","08/20/2014","Photo Credit: Barb Lyter","Naval Air Station Whidbey Island in Oak Harbor, WA","The Naval Air Station Whidbey Island is the city's","Oak Harbor"
"151BUR0608KMY1256_0_2.jpg","08/20/2014","08/20/2014","Kevin Young","Fletcher Allen Medical Center in Burlington, VT","Fletcher Allen Medical Center has been recognized for its environmental practices, winning a Partners for Change Award from Practice Greenhealth in June 2008.",
"Franklin_TN_Pinkerton_Park2.jpg","08/10/2016","08/10/2016","Jeffrey S. Otto","Franklin TN Pinkerton Park","Pinkerton Park is one of Franklin, TN's most popular parks that offers a one-mile paved pedestrian track that circles the park.","Franklin"
"151BUR0608KMY1299_0_1.jpg","08/20/2014","08/20/2014","Kevin Young","Red Square Bar & Grill in Burlington, VT","Red Square Bar & Grill features outdoor dining and live music.",
"151BUR0608KMY1380_1_2.jpg","08/20/2014","08/20/2014","Kevin Young","Converse Hall at UVM in Burlington, VT","UVM's Converse Hall, a dormitory, was built in 1895 in Burlington, VT.",
"70108WA0623_1.jpg","08/20/2014","08/20/2014","Wes Aldridge","Ferris Wheel at the Champlain Valley Fair in Burlington, VT","The Champlain Valley Fair in Burlington, VT provides entertainment for residents with live music performances, a tractor pull, rides, and more.",
"151BUR0608KMY1290_0_0.jpg","08/20/2014","08/20/2014","Kevin Young","ECHO Lake Aquarium and Science Center in Burlington, VT","Kids can enjoy more than 100 hands-on exhibits at the ECHO at the Leahy Center for Lake Champlain, a lake aquarium and science center in Burlington, VT.",
"151BUR0608KMY1518_3.jpg","08/20/2014","08/20/2014","Kevin Young","Church Street Marketplace in Burlington, VT","The four-block Church Street Marketplace in Burlington, VT was completed in 1981, remaining a popular shopping and dining destination more than 20 years later.",
"6541011jso8479.jpg","08/20/2014","08/20/2014","Jeffrey S. Otto","Festivals in Nashville, TN's Centennial Park","People gather on the grounds of the Parthenon in Centennial Park in Nashville during the Celebrate! Nashville Cultural Festival.",
"151SARSUB008_0.JPG","08/20/2014","08/20/2014","Photo courtesy of the Saratoga Springs Chamber of Commerce","The Saratoga Springs Farmers Market in NY","The Saratoga Springs Farmers Market serves up high-quality","Saratoga Springs"
"151SARSUB010_0.jpg","08/20/2014","08/20/2014","Photo courteys of Sperry's","Sperry's Restaurant in Saratoga Springs, NY","Sperry's is a local fine dining favorite. Learn more about","Saratoga Springs"
"151SARSUB003_0.jpg","08/20/2014","08/20/2014","Photo courtesy of flickr user Dougtone","Saratoga Springs' Downtown in NY","Business is booming in Saratoga Springs. Take a look at the city's Dougtone","Saratoga Springs"
"151SARSUB002_0.jpg","08/20/2014","08/20/2014","Photo courtesy of flickr user Dougtone","Shops in Saratoga Springs, NY","Known as the &quot;Crossroads of Northeast North America,&quot; Saratoga Springs prime location makes it an ideal spot forDougtone","Saratoga Springs"
"151SARSUB011_1.jpg","08/20/2014","08/20/2014","Photo by Flickr user Dougtone","Neighborhood in Saratoga Springs, NY","Saratoga Springs was named one of CNN Money's 100 Best Places to Live. Learn more about the city's Dougtone &nbsp;","Saratoga Springs"
"151SARSUB005_0.jpg","08/20/2014","08/20/2014","Photo courtesy of the Saratoga Springs Chamber of Commerce","Kayaker in Saratoga Springs, NY","Winter and water","Saratoga Springs"
"151SARSUB004_0.JPG","08/20/2014","08/20/2014","Photo courtesy of the Saratoga Springs Chamber of Commerce","Saratoga Springs Race Track in NY","The world-famous Saratoga Springs Race Track opened in 1863, and remains one of the city's biggest","Saratoga Springs"
"151SARSUB006_0.jpg","08/20/2014","08/20/2014","Photo courtesy of the Saratoga Springs Chamber of Commerce","Saratoga National Historic Park in Saratoga Springs, NY","Saratoga Springs offers all kinds of","Saratoga Springs"
"151OVESUB006.jpg","08/20/2014","08/20/2014","Visit Overland Park",,"The Indian Hill Hike and Bike Trail is almost 17 miles long, and is only one of the ways residents stay active.","Overland Park"
"151OVESUB010_1.jpg","08/20/2014","08/20/2014","Photo by Flickr user David Reber",,"Among Overland Park's top employers are Johnson County Community College and Overland Park Regional Medical Center. Photo by Flickr user David Reber","Overland Park"
"151OVESUB009.jpg","08/20/2014","08/20/2014","Photo courtesy of Visit Overland Park",,"Scenery like the South Lake Park makes the area a desirable place to live.","Overland Park"
"151OVESUB007.jpg","08/20/2014","08/20/2014","Photo courtesy of Visit Overland Park",,"Overland Park's shopping options include Oak Park Mall and Town Center Plaza.","Overland Park"
"151OVESUB004.jpg","08/20/2014","08/20/2014","Photo courtesy of Visit Overland Park",,"Fiorella's Jack Stack Barbecue is a local favorite. Learn more about local restaurants in Overland Park.","Overland Park"
"151OVESUB002.jpg","08/20/2014","08/20/2014","Photo courtesy of Visit Overland Park",,"Deanna Rose Children's Homestead lets urban residents experience the charm of rural living. Find out what other attractions the city has to offer.","Overland Park"
"151OVESUB003.jpg","08/20/2014","08/20/2014","Timothy Hursley",,"Overland Park's cultural attractions include the Nerman Museum of Contemporary Art.","Overland Park"
"151OASUBK008_0.JPG","08/20/2014","08/20/2014","Photo courtesy of the Whidbey Playhouse, Inc.","Whidbey Playhouse in Oak Harbor, WA","Oak Harbor's","Oak Harbor"
"151OAKSUB002_0.jpg","08/20/2014","08/20/2014","Photo by Pam Headridge","Deception Pass State Park in Oak Harbor, WA","The beautiful Deception Pass State Park attracts more than 2 million visitors each year. Learn more about Oak Harbor's","Oak Harbor"
"151OAKSUB005_0.jpg","08/20/2014","08/20/2014","Photo Credit: Brian Smith","Windjammer Park in Oak Harbor, WA","This beautiful windmill at Windjammer Park is just one of the city's many http://livability.com/oak-harbor/wa/attractions/oak-harbor-wa-attractio… to see.","Oak Harbor"
"151SARSUB012.jpg","08/20/2014","08/20/2014","Photo by Andy Camp","Skidmore College in Saratoga Springs, NY","Among the city's","Saratoga Springs"
"151CAMSUB004_2.jpg","08/20/2014","08/20/2014","Photo by Gabriel Loughlin Photography",,"Weeks Footbridge, a pedestrian bridge in Cambridge, MA.","Cambridge"
"151CAMSUB012_0.jpg","08/20/2014","08/20/2014","Photo by Ivo Gretener Photography","City Hall in Cambridge, MA","Among Cambridge's","Cambridge"
"151CAMSUB011_0.jpg","08/20/2014","08/20/2014","Photo by Gabriel Loughlin Photography","The T Train in Cambridge, MA","Access to multiple modes of public transportation boosts the area's","Cambridge"
"151CAMSUB010_0.jpg","08/20/2014","08/20/2014","Photo courtesy of Ivo Gretener Photography","Harvard University in Cambridge, MA","Cambridge is home to big-name schools like Harvard University and MIT, as well as a number of","Cambridge"
"151CAMSUB009_0.jpg","08/20/2014","08/20/2014","Photo by Gabriel Loughlin Photography","Inman Square in Cambridge, MA","Cambridge is well-suited to young professionals, and its many","Cambridge"
"151CAMSUB005_0.jpg","08/20/2014","08/20/2014","Photo by Ivo Gretener Photography","Harvard Square in Cambridge, MA","Harvard Square is one of the city's most popular","Cambridge"
"151CAMSUB008_0.jpg","08/20/2014","08/20/2014","Photo by Flickr user cremglace","Charles River in Cambrige, MA","The Charles River is perfect for cremglace&nbsp;","Cambridge"
"151CAMSUB003.jpg","08/20/2014","08/20/2014","Photo by Andy Ryan","Bondir Restaurant in cambridge, MA","Bondir is a farmhouse-style restaurant that serves up primarily local food. Learn more about other","Cambridge"
"151CAMSUB007_1.jpg","08/20/2014","08/20/2014","Photo courtesy of Oleana Restaurant","Oleana Restaurant in Cambridge, MA","Cambridge's","Cambridge"
"151CAMSUB006jpg_0_1.jpg","08/20/2014","08/20/2014","Photo by Gabriel Loughlin Photography","Mount Auburn Cemetery in Cambridge, MA","Though cemeteries don't usually scream","Cambridge"
"151CAMSUB001_1.jpg","08/20/2014","08/20/2014","Photo by Flickr user Manu_H","MIT's Stata Center in Cambridge, MA","MIT's Stata Center is well-known for its unique architecture, and proves to be not only an academic building but one of the city's most noticeable Manu_H","Cambridge"
"7480808BM4997.jpg","07/30/2017","08/20/2014","Brian McCord",,,
"151BLASUB023.jpg","08/20/2014","08/20/2014","Photo: Jim Stroup","Burruss Hall at Virginia Tech in Blacksburg, VA","Burruss Hall is located on the campus of Virginia Tech in Blacksburg, Virginia.","Blacksburg"
"151ANNSUB030.jpg","08/20/2014","08/20/2014","Photo: VisitAnnArbor.org",,"State Theatre in Ann Arbor, Michigan, is located near the University of Michigan at the intersection of State Street and Liberty Street.","Ann Arbor"
"151ATHSUB005_0_0.jpg","08/20/2014","08/20/2014","Photo: Marcus Williams","College Square in Athens, GA Near University of Georgia","College Square in downtown Athens, Georgia is located near the University of Georgia.",
"151BLOSUB009_0.jpg","08/20/2014","08/20/2014","Photo: Visit Bloomington","Kirkwood Avenue in Bloomington, IN Near Indiana University","Kirkwood Avenue in Bloomington, Indiana links Indiana University to the city's downtown area.","Bloomington"
"151CORSUB003.jpg","08/28/2017","08/20/2014","Courtesy of Oregon State University Marketing","Oregon State University in Corvallis, OR","Oregon State University is located in Corvallis, Oregon.","Corvallis"
"151LAWSUB011.jpg","08/20/2014","08/20/2014","Photo: KU Marketing Communications","Big Jay at Memorial Stadium in Lawrence, KS","Big Jay, the University of Kansas mascot, entertains the crowd at Memorial Stadium in Lawrence, Kansas.","Lawrence"
"151LOGSUB002_0.jpg","08/20/2014","08/20/2014","Photo: USU Public Relations & Marketing","Utah State University in Logan, UT","Utah State University is located in Logan, Utah.",
"151OXFSUB028_1.jpg","08/20/2014","08/20/2014","Photo: Robert Jordan","The Circle at the University of Mississippi in Oxford, MS","A professor moves class outside to The Circle at the University of Mississippi in Oxford, Mississippi.","Oxford"
"151COLSUB021_1.JPG","08/20/2014","08/20/2014","Photo: Texas A&M University","Academic Building at Texas A&M University in College Station, TX","The Academic Building at Texas A&M University is in College Station, Texas.","College Station"
"151BLOSUB008.jpg","08/20/2014","08/20/2014","Photo: Visit Bloomington","Students Picnic at Indiana University in Bloomington, IN","Students picnic at Indiana University in Bloomington, Indiana.",
"151CHASUB001_0_1.jpg","08/20/2014","08/20/2014","Photo: University of Illinois at Urbana-Champaign","Main Quad at the University of Illinois at Urbana-Champaign in Champaign, IL","Students make their way through the historic Main Quad at the University of Illinois at Urbana-Champaign in Champaign, Illinois.","Champaign"
"151HOTSUB009_0.jpg","08/20/2014","08/20/2014","Photo by Bernie Jungkind","Lake Homes in Hot Springs, AR",,
"151HOTSUB007_0.JPG","08/20/2014","08/20/2014","Photo courtesy of the Hot Springs Chamber of Commerce","Garvin Gardens in Hot Springs, AK","Hot Springs offers plenty of ways to",
"151HOTSUB003_0_1.jpg","09/22/2014","09/22/2014","Photo courtesy of Flickr user ilovebutter","Hot Springs, AR's Fordyce Bathhouse","Fordyce Bathhouse is arguably the most famous bathhouse in Hot Spring's ilovebutter","Hot Springs"
"151HOTSUB006.JPG","08/20/2014","08/20/2014","Photo courtesy of the Hot Springs Chamber of Commerce","Oaklawn Park in Hot Springs, AR","The Oaklawn Park racetrack has been a Hot Springs landmark for more than 100 years. Learn more about http://livability.com/hot-springs/ar/attractions/hot-springs-ar-attract…; in the area.",
"151HOTSUB008_0.jpg","08/20/2014","08/20/2014","Photo by Flickr user Rennett Stowe","Arkansas Career Training Institute in Hot Springs","The old Army Navy Hospital in San Bernardino is now the Arkansas Career Training Institute. More traditional education options includ http://livability.com/hot-springs/ar/schools/hot-springs-ar-higher-educ… Park Community College and multiple http://livability.com/hot-springs/ar/schools/hot-springs-ar-public-and-… and private schools.   Photo by Flickr user http://www.flickr.com/photos/tomsaint/"">Rennett Stowe&nbsp;",
"151HOTSUB002_0.jpg","07/26/2017","08/20/2014","Photo courtesy of Flickr user ilovebutter","Downtown Hot Springs, AR","ilovebutter","Hot Springs"
"7081111AB8379_0.jpg","08/20/2014","08/20/2014","Antony Boshier","Biking at Tyler State Park in Tyler, TX","Tyler State Park is a great place to bike, hike, and do more manly activities in the Tyler, TX area.","Tyler"
"7870211JWA7618_1.jpg","08/20/2014","08/20/2014","Jeff Adkins","Texas Christian University Campus in Fort Worth, Texas","Fort Worth's Texas Christian University houses over 300,000 students every year and provides students with job-ready knowledge in preparation for graduation.","Fort Worth"
"151CORSUB002_2.jpg","08/20/2014","08/20/2014","Photo courtesy of City of Coral Gables","Coral Gables Merrick House in FL","The Coral Gables Merrick House was the home of city founder George Merrick, and one of the Coral Gables' top","Coral Gables"
"151CORSUB007_0.jpg","08/20/2014","08/20/2014","Photo by Eric Espada","The University of Miami Hurricanes in Coral Gables, FL","The University of Miami is Coral Gables' main top employer.&nbsp;","Coral Gables"
"151CORSUB005_0.jpg","08/20/2014","08/20/2014","Photo by Flickr user The Miami Story","Home in Coral Gables, FL","Coral Gables features a mix of suburban and urban http://livability.com/coral-gables/fl/living/coral-gables-fl-neighborho…;. Photo by Flickr user","Coral Gables"
"151CORASUB003_1.jpg","08/20/2014","08/20/2014","Photo courtesy of the City of Coral Gables","Morton's on the Miracle Mile in Coral Gables, FL","The Miracle Mile is a stretch of downtown dedicated to http://livability.com/coral-gables/fl/shopping/coral-gables-fl-shopping…;, boutiques and restaurants.&nbsp;","Coral Gables"
"151CORSUB006_0_0.jpg","08/20/2014","08/20/2014","Photo courtesy of Flickr user Gables by the Sea","Coral Gables, FL Waterfront","The water provides plenty of activities for Coral Gables residents. Photo courtesy of Flickr user The Miami Story http://www.flickr.com/photos/themiamistory/","Coral Gables"
"151CORSUB001_0_0.jpg","08/20/2014","08/20/2014","Photo courtesy of the City of Coral Gables","The Venetian Pool in Coral Gables, FL","The Venetian Pool is one of Coral Gables' most popular attractions.","Coral Gables"
"151DULSUB007_0.jpg","08/20/2014","08/20/2014","Photo by Dennis O'Hara","Lake Superior in Duluth, MN","Sailboats leave the Duluth harbor for a day of of sailing on Lake Superior.","Duluth"
"151DULSUB007_1.jpg","08/20/2014","08/20/2014","Photo by Dennis O'Hara","Lake Superior in Duluth, MN","Sailboats leave the Duluth harbor for a day of of sailing on Lake Superior.","Duluth"
"151DULSUB010_0.jpg","08/20/2014","08/20/2014","Photo courtesy of Visit Duluth","Lake Superior's Shore in Duluth, MN","Residents of this Duluth's North Shore","Duluth"
"151DULSUB006_0.jpg","08/20/2014","08/20/2014","Photo courtesy of Visit Duluth","DeWitt-Seitz Marketplace in Duluth, MN","The historic DeWitt-Seitz Marketplace is one of the city's best places to","Duluth"
"151DULSUB017.jpg","08/20/2014","08/20/2014","Photo courtesy of Visit Duluth","University of Minnesota-Duluth","UMD is a public research university that offers 13 different bachelor’s degrees in almost 75 majors.","Duluth"
"151DULSUB016.jpg","08/20/2014","08/20/2014","Photo by Robert Welton","Shipping Channel in Duluth, MN","Duluth's shipping channel brings business to the city.&nbsp;","Duluth"
"6960908JWA0913_1.jpg","07/30/2017","08/20/2014","Jeff Adkins","""The Twins"" by Idaho Artist David Clemons in Twin Falls, ID","""The Twins"" by Idaho artist David Clemons overlooks the Snake River Canyon and the Perrine Bridge in Twin Falls, ID.","Twin Falls"
"69606SUB001_1.jpg","08/20/2014","08/20/2014","Photo Courtesy Of Twin Falls Center for the Arts","Twin Falls Center for the Arts","Twin Falls Center for the Arts (associated with the Magic Valley Arts Council) in Southern Idaho.","Twin Falls"
"151LEBSUB005_0.JPG","08/20/2014","08/20/2014","Photo courtesy of Visit Wilson County","Five Oaks Golf and Country Course in Lebanon, TN","Five Oaks Golf and Country Course is an 18-hole course spread over 500 acres of tree-filled vistas. Learn about other","Lebanon"
"151LEBSUB010_0.jpg","08/20/2014","08/20/2014","Photo by Bill Lafaevre","Lochinvar in Lebanon, TN","Lochinvar is one of the city's","Lebanon"
"151LEBSUB009_0.JPG","08/20/2014","08/20/2014","Photo courtesy of the Joint Economic & Community Development Board of Wilson County","Cumberland University in Lebanon, TN","Lebanon&rsquo;s only university is private Cumberland University, founded over 150 years ago. Learn about","Lebanon"
"151LEBSUB008_0.jpg","08/20/2014","08/20/2014","Photo courtesy of Visit Wilson County","Downtown Lebanon, TN","Lebanon's city center is a popular","Lebanon"
"151LEBSUB006.jpg","08/20/2014","08/20/2014","Photo courtesy of Visit Wilson County","The Mill at Lebanon, TN","The historic Mill at Lebanon is made up of local and unique stores.","Lebanon"
"151LEBSUB003_0.jpg","08/20/2014","08/20/2014","Photo courtesy of Visit Wilson County","The Wilson County Fair in Lebanon, TN","The Wilson County Fair draws over 5,000 attendees each year, and is one of the county's biggest","Lebanon"
"7851111AB1101.jpg","08/20/2014","08/20/2014","Antony Boshier","Kaydon Corporation in Sumter, SC","Lisa Allen and Betty Pierson work on assembling bearings at Kaydon Corporation, which is a bearing manufacturer in Sumter, South Carolina.",
"7851111AB0775.jpg","08/20/2014","08/20/2014","Antony Boshier","Liberty Street Improvements in Sumter, SC","A construction crew pours concrete on Liberty Street, which was made possible by the Penny for Projects program.",
"7350609THB0195_1_1.jpg","08/20/2014","08/20/2014","Todd Bennett","The Villager store in Kinston, NC","The Villager is one of several stores at The Village in Kinston, NC.","Kinston"
"D Tower 21_0.jpg","08/20/2014","08/20/2014","Commonwealth Health Corporation","Medical Center at Bowling Green","Medical Center at Bowling Green in Bowling Green, KY.","Bowling Green"
"151SAN0708kmy9949_0_1.jpg","08/20/2014","08/20/2014","Kevin Young","Southwest Acupuncture College in Santa Fe, NM","Several institutes of higher education call Santa Fe home, including Southwest Acupuncture College.",
"151SAN0708kmy9877_0_1.jpg","08/20/2014","08/20/2014","Kevin Young","Downtown Shops in Santa Fe, NM","Santa Fe's rich cultural heritage in the arts is evidenced by many of its historic downtown craft shops.",
"151SAN0708kmy9852_0_0.jpg","08/20/2014","08/20/2014","Kevin Young","Santa Fe Festivals","Santa Fe Festivals",
"151SAN0708kmy9938_0_0.jpg","08/20/2014","08/20/2014","Kevin Young","St. Vincent Regional Medical Center in Santa Fe, NM","St. Vincent Regional Medical Center offers 268 licensed beds and 300 physicians representing 22 medical specialties.",
"151LAFSUB006_0.jpg","08/20/2014","08/20/2014","Photo by Bernadette Heath","Lake Martin Swamp in Lafayette, LA","Located midway between Lafayette and Breaux Bridge is Lake Martin Swamp, famous for scenic beauty and abundant wildlife.","Lafayette"
"151LAFSUB002_0_1.jpg","08/20/2014","08/20/2014","Photo by Kent Hutslar","Acadian Village Chapel in Lafayette, LA","Acadian Village Lafayette's original museum of authentic Acadian homes.","Lafayette"
"151LAFSUB007_0_1.jpg","08/20/2014","08/20/2014","Photo by Nahoko Miyake","University of Louisiana at Lafayette","Martin Hall is one of the oldest buildings on UL's campus.","Lafayette"
"151LAFSUB004_0_2.jpg","08/20/2014","08/20/2014","Photo courtesy of the Lafayette Convention & Visitors Commission","Seafood in Lafayette, LA","Boiled crabs are a regular Cajun cuisine and a local favorite.","Lafayette"
"151LAFSUB001_0.jpg","08/20/2014","08/20/2014","Photo by Philip Gould","Lafayette Mardi Gras in LA","Lafayette Mardi Gras celebration is a big attraction each year.&nbsp;","Lafayette"
"151SANBSUB003a_1.jpg","08/20/2014","08/20/2014","Photo courtesy of the San Bernardino CVB","Tri-City Lake in San Bernardino, CA","Tri-City Lake, located in the Hospitality Lane business district in San Bernardino.","San Bernardino"
"151SANBSUB002_1.jpg","08/20/2014","08/20/2014","Photo by Flickr user Chuck Coker","Home in San Bernardino, CA","A unique home in San Bernardino, CA.  Photo by Flickr user","San Bernardino"
"151SANBSUB006_1.jpg","08/20/2014","08/20/2014","Photo courtesy of the San Bernardino CVB","San Bernardino Mountains in San Bernardino, CA","Skiing in the San Bernardino Mountains is one of the many activities available to residents.","San Bernardino"
"151SANBSUB005_0.jpg","08/20/2014","08/20/2014","Photo courtesy of the San Bernardino CVB","San Bernardino National Forest in CA","The San Bernardino National Forest spans about 660,000 acres of the San Bernardino Mountains, and is an attraction visitors won't want to miss.","San Bernardino"
"151SANBSUB004_0.jpg","08/20/2014","08/20/2014","Photo courtesy of the San Bernardino CVB","McDonald's Site and Museum in San Bernardino, CA","The McDonalds brothers opened the original McDonalds restaurant on December 12, 1948 in San Bernardino. The site is one of the city's biggest attractions today.","San Bernardino"
"3500409IC0054_1.jpg","06/15/2017","08/20/2014","Ian Curcio",,"Marty Ropen and Michelle Hamby perform in Moonshine & Thunder - The Junior Johnson Story.",
"151NORSUB002_0.jpg","08/20/2014","08/20/2014","Photo: Wilkes Chamber of Commerce","Biking in North Wilkesboro, NC","Biking in North Wilkesboro, North Carolina.",
"7510908JWA8598.jpg","08/20/2014","08/20/2014","Jeff Adkins","The Mint Bar in Downtown Sheridan, WY","Customers enjoy drinks while visiting The Mint Bar in downtown Sheridan, Wyoming, which has been in business for more than 100 years.","Sheridan"
"151CLISUB012_0.jpg","08/20/2014","08/20/2014","Photo: White Linen Photography","Clive Festival in Clive, IA","The Clive Festival takes place annually in Clive, Iowa.","Clive"
"151YANSUB006_0.jpg","08/20/2014","08/20/2014","Photo: Nathan Bergeson","Riverboat Days and Summer Arts Festival in Yankton, SD","The Riverboat Days and Summer Arts Festival in Yankton, South Dakota includes a fireworks show.","Yankton"
"78110SUB010.jpg","08/20/2014","08/20/2014","Photo: Meridith Khan","Thomas Jefferson Wine Festival in Bedford, VA","The Thomas Jefferson Wine Festival takes place in Bedford, Virginia.","Bedford"
"151CHASUB011_1.jpg","08/20/2014","08/20/2014","Photo: G-TV","Chardon Art Festival in Chardon, OH","The Chardon Art Festival takes place in Chardon, Ohio.","Chardon"
"6920509jkk3913.jpg","08/20/2014","08/20/2014","J. Kyle Keener","Boerne Village Band at Abendkonzerte in Boerne, TX","Members of the Boerne Village Band perform at Abendkonzerte in Boerne, Texas.","Boerne"
"151BRASUB005_0.JPG","08/20/2014","08/20/2014","Photo: Greg Lesch/Brattleboro Chamber of Commerce","Main Street in Downtown Brattleboro, VT","Main Street in downtown Brattleboro, Vermont.",
"151GOLSUB001_0.jpg","08/20/2014","08/20/2014","Photo: Visit Golden","Washington Avenue in Downtown Golden, CO","A “Howdy Folks! Welcome to Golden” arch spans Washington Avenue in downtown Golden","Golden"
"151PAPSUB009_0.jpg","08/20/2014","08/20/2014","Photo: City of Papillion","Papillion Days Parade in Downtown Papillion, NE","The annual Papillion Days parade takes place in downtown Papillion, Nebraska.","Papillion"
"7510809BM3432_6.jpg","08/20/2014","08/20/2014","Brian McCord","3rd Thursday Street Festival in Downtown Sheridan, WY","The 3rd Thursday Street Festival is held each third Thursday in June, July, August, and September in Sheridan, Wyoming.",
"6710205AB3820_1.jpg","08/23/2017","08/20/2014","Antony Boshier","Skiing near Albuquerque, NM","Skiing Enthusiasts Flock to Central New Mexico Slopes- such as the Sandia Peak Ski Resort near Albuquerque, NM.","Albuquerque"
"151DANSUB013.jpg","08/20/2014","08/20/2014","Photo: Clay Jackson","Downtown Danville, KY","Downtown Danville, KY is one reason the city is a Top 10 Small Town.","Danville"
