"name","post_modified","post_date","byline","alt_text","description","place_name"
"604SUBGIL001.jpg","08/20/2014","08/20/2014",,"Dry Fork Station Near Gillette, WY","Dry Fork Station, a coal-based electric generation power plant, contributes to Gillette's thriving energy industry.","Gillette"
"6750709IC0135.jpg","08/20/2014","08/20/2014","Staff Photographer","Housing costs vary significantly in cities across the U.S.",,
"151SUBGRE019.JPG","08/20/2014","08/20/2014","Photo by David Haskins","Auspicious Miss, based in Greenville, S.C., is thriving, thanks to mobile payments.",,
"151SUBLIV030_0.jpg","08/20/2014","08/20/2014","Photo by Tony Hall","Airstream vehicles have been manufactured in Jackson Center, Ohio, for more than 60 years.",,
"151SUBGRA025.jpg","08/20/2014","08/20/2014","Rendering courtesy of RiverRestoration","The Grand River in downtown Grand Rapids, Mich., will eventually have a Fish Passage.",,
"151SUBKAN001.jpg","08/20/2014","08/20/2014","Photo courtesy of Google","Google Fiber is improving Internet speed in Provo, Utah; Kansas City, Mo.; and Austin, Texas.",,
"151SUBCLE002_0.JPG","08/20/2014","08/20/2014","Photo courtesy of the National Training Center","The South Lake Hospital National Training Center complex has an Olympic-size pool.",,
"151SUBIND013_10.jpg","08/20/2014","08/20/2014","Photo: Lavengood Photography","White River State Park in downtown Indianapolis includes the Central Canal.",,
"151SUBVER026_0.jpg","08/20/2014","08/20/2014","Photo courtesy of Made in Vermont Marketplace","Made in Vermont Marketplace features a variety of locally made products.",,
"151SUBMOU001_0.jpg","08/20/2014","08/20/2014","Photo: Yuxuan Wang","Shoreline Park in Mountain View, Calif., is a top spot for outdoor recreation.",,
"151SUBNAP005.jpg","08/20/2014","08/20/2014","Photo: Ian Freimuth","Downtown Naperville, Ill., includes a theater district, shops, restaurants and more.",,"Naperville"
"7900813WJO9089_3.jpg","08/20/2014","08/20/2014","Photo: Staff Photographer","Ecce Art + Yoga in downtown Fargo, N.D., showcases works created by local artists.",,
"151SUBANN007.jpg","08/20/2014","08/20/2014","Photo: Ann Arbor Area Convention & Visitors Bureau","Performance venues, art galleries and other attractions draw young people to downtown Ann Arbor, Mich.",,"Ann Arbor"
"151SUBHOB002.jpg","08/20/2014","08/20/2014","Photo: Mary Madigan","Pier parks in Hoboken, N.J., are favorite outdoor destinations during warm months.",,"Hoboken"
"151MINSUB007_0.jpg","08/20/2014","08/20/2014","Photo: Minneapolis Convention & Visitors Bureau","Nicollet Mall in downtown Minneapolis, Minn., is known for its many shops and restaurants.",,"Minneapolis"
"151SUBBET004.jpg","08/20/2014","08/20/2014","Photo: ehpien","Bethesda Row in Bethesda, Md., includes a mix of eateries, shops, apartments and offices.",,
"Bellevue_WA_Downtown_Skyline.jpg","05/06/2019","08/11/2016","Marv Heston @ Heston Photo","Bellevue WA Downtown","Bellevue WA has a thriving downtown area and more than 100 parks.","Bellevue"
"151SUBATL017.JPG","08/20/2014","08/20/2014","Photo by Jennifer Jamison","New Jersey's Atlantic City High School has become a favorite spot for students.",,
"151SUBHUN033.jpg","08/20/2014","08/20/2014","Photo courtesy of Clinton Row","Clinton Row in downtown Huntsville, Ala., includes mini storage units and retail spaces.",,
"151SUBSAN029_0.jpg","08/20/2014","08/20/2014","Photo by Vanessa Vancour","San Diego, Calif., is one of America's best places to live.",,
"7080114WJO0937.jpg","08/20/2014","08/20/2014","Staff Photographer","The WaterPark @ The Villages Near Tyler, TX","The WaterPark @ The Villages, Silverleaf Resorts, is a popular destination for family fun near Tyler, TX. The indoor water park has slides, a lazy river, a wave pool and more.","Tyler"
"7080114WJO0408.jpg","08/20/2014","08/20/2014","Staff Photographer","Currents Restaurant in Tyler, TX","Currents Restaurant offers French and American cuisine in an intimate setting. Have a drink at the bar, or enjoy such dishes as the goat cheese puff pastry or crab fingers.","Tyler"
"7080114WJO0525.jpg","08/20/2014","08/20/2014","Wendy Jo O'Barr","Bridges on Kinsey in Tyler, TX","The Bridges on Kinsey offers apartment living and top-notch amenities in Tyler, TX.","Tyler"
"7080114WJO0547.jpg","08/20/2014","08/20/2014","Staff Photographer","Louis & Peaches Owen Heart Hospital in Tyler, TX","Louis & Peaches Owen Heart Hospital is part of Trinity Mother Frances Hospitals and Clinics in Tyler, TX.","Tyler"
"7080114WJO0039.jpg","08/20/2014","08/20/2014","Wendy Jo O'Barr","Tyler, TX Small Business Development Center","Tyler's Small Business Development Center helps local entrepreneurs successfully build their businesses.","Tyler"
"7081013FO9993.jpg","08/20/2014","08/20/2014","Frank Ordonez","Tyler Rose Garden in Tyler, TX","The Tyler Rose Garden includes 35,000 rose bushes and more than 500 varieties of roses.","Tyler"
"7080114WJO0141.jpg","08/20/2014","08/20/2014","Staff Photographer","The Market at the Crossing in Tyler, TX","The Market at the Crossing in Tyler, TX, includes shops, restaurants, a spa and more.","Tyler"
"7080112MJC4147.jpg","08/20/2014","08/20/2014","Michael Conti","Lago del Pino in Tyler, TX","Tyler's Lago del Pino restaurant features live music and dancing on Friday and Saturday nights.","Tyler"
"694WJO02140473_0.jpg","08/20/2014","08/20/2014","Staff Photographer","The Public Library of Johnston County and Smithfield includes Louis Orr etchings featuring North Carolina landmarks.",,
"694WJO02140473_1.jpg","08/20/2014","08/20/2014","Staff Photographer","The Public Library of Johnston County and Smithfield includes Louis Orr etchings featuring North Carolina landmarks.",,"Smithfield"
"151SUBOHI024.jpg","08/20/2014","08/20/2014","Photo courtesy of Hattie Larlham","Hattie Larlham, a center for disabled adults and children, recruits volunteers using LinkedIn.",,
"PRCHSTK40306.jpg","08/20/2014","08/20/2014",,"Community Health Workers are helping hospital patients recover by providing emotional support.",,
"151SUBDEN009_1.jpg","08/20/2014","08/20/2014","Photo courtesy of the Denver Derby","Denver's Derby Day event draws more than 5,000 people and raises money for a scholarship fund.",,
"151SUBMIA019.jpg","08/20/2014","08/20/2014","Photo courtesy of Kimbia","Give Miami Day 2013: The Miami Foundation celebrates as they raise $1 million dollars. They would go on to raise over $3.2M.",,
"PRCHSTK93470591.jpg","08/20/2014","08/20/2014",,"Ogden, San Diego, Denver, Daytona Beach and Colorado Springs are good cities for allergy sufferers.",,
"151SUBMIN015_0.jpg","08/20/2014","08/20/2014","Photo courtesy of Meet Minneapolis","Downtown Minneapolis' Stone Arch Bridge hosts music and cultural festivals and is a popular place to exercise.",,
"151SUBGOS016.jpg","08/20/2014","08/20/2014","Photo courtesy of Katie Collins","Boston University students volunteered at LaCasa Inc. in Goshen, Ind., through the Alternative Spring Break program.",,
"151SUBKAN006_0.jpg","08/20/2014","08/20/2014","Photo courtesy of Oklahoma Joe's","Oklahoma Joe's in Kansas City, Kan., is one of the best barbecue restaurants in the U.S.",,
"151SUBLIV007.jpg","08/20/2014","08/20/2014","Photo courtesy of the Middle Tennessee State University UAS Program","Unmanned aircraft systems, also known as drones, are expected to bring major benefits to cities across the U.S.",,
"151SUBLIV013 1.jpg","08/20/2014","08/20/2014","Photo courtesy of A.J. Jones","Celebrate National Bike Month by following a few tips to help keep bikers safe on the road.",,
"151SUBELP018_0.jpg","08/20/2014","08/20/2014","Photo courtesy of El Paso Museum of History","El Paso's new Touch City 3-D Digital Wall will bring the city's history and culture to life in a hands-on way.",,
"151SUBLIV012.jpg","08/20/2014","08/20/2014","Photo courtesy of Kelsi Farrington","Make sure your yard sale doesn't fail by following seven simple tips.",,
"151SUBDUF008_2.jpg","08/20/2014","08/20/2014","Photo courtesy of What the Festival","What the Festival in Dufur, Ore., hosts the Northwest's largest pool party.",,
"151SUBLIV010_0.jpg","08/20/2014","08/20/2014",,"Just by following a few easy tips, you can develop better relationships with your neighbors.",,
"151SUBLIV004.jpg","08/20/2014","08/20/2014","Photo courtesy of Stephen Willis","Merle Haggard's Okie from Muskogee song paints a picture of what it's like to live in a small town.",,
"151SUBFIS001.jpg","08/20/2014","08/20/2014","Photo courtesy of Lavengood Photography","The Connor Prairie Interactive History Park is a favorite destination in Fishers, Ind.",,
"151SUBLIV011.jpg","08/20/2014","08/20/2014","Photo courtesy of Lafayette College","Fun activities, good food and warm weather make any block party a success.",,
"151SUBLIV009_1.jpg","08/20/2014","08/20/2014","Photo courtesy of Kathryn Johnson","Southern dairies are making it easy for the region's shops and restaurants to create artisan cheeses.",,
"6470409THB7645.jpg","08/20/2014","08/20/2014","Photo by staff photographer","Chickens and hens are now moving into urban neighborhoods in cities around the U.S.",,
"151SUBLOU002.jpg","08/20/2014","08/20/2014","Photo courtesy of WHY Louisville","Known for its quirky atmosphere, WHY Louisville sells unique items created by local residents.",,
"151SUBCOL014.jpg","08/20/2014","08/20/2014","Photo courtesy of columbuscommons.org","Columbus Commons, formerly City Center Mall, hosts fun events throughout the year.",,
"151SUBIND020_1.jpg","08/20/2014","08/20/2014","Photo courtesy of Visit Indy","The Indianapolis Cultural Trail is a favorite destination for walking, jogging and biking.",,
"759WJO02140089_1.jpg","08/20/2014","08/20/2014","Staff Photographer","The Port of Vicksburg in Vicksburg, MS","The Port of Vicksburg is one of the largest inland ports in the U.S. and is in a critical geographical position - halfway between Memphis and New Orleans.","Vicksburg"
"75904SUB005_0.jpg","08/20/2014","08/20/2014",,"FRC Team 456 Siege Robotics in Vicksburg, MS","Comprising high school students from Vicksburg, FRC Team 456 Siege Robotics builds robots in competitions across the U.S.","Vicksburg"
"8080713MJC0343.jpg","06/19/2017","08/20/2014","Michael Conti","Wal-Mart Supercenter in Fayetteville, AR","Wal-Mart is one of the top employers in Fayetteville, AR, along with University of Arkansas.",
"151FAYSUB010_0.jpg","08/20/2014","08/20/2014","Photo: Tom Ewart/NWA Photography","Bikes, Blues & BBQ in Fayetteville, AR","Bikes, Blues & BBQ takes place annually in Fayetteville, AR, and is a major reason why Fayetteville made our Top 10 BBQ Cities list.","Fayetteville"
"80801SUB0091.jpg","06/19/2017","08/20/2014","Fayetteville Advertising and Promotion Commission","Lake Fayetteville Spillway Bridge in Fayetteville, AR","Lake Fayetteville Spillway Bridge provides 194 acres of water with a marina and fishing piers for residents in Fayetteville, AR.",
"1510412AB5151.jpg","08/20/2014","08/20/2014","Antony Boshier",,"Decatur General Hospital in Decatur Alabama.","Decatur"
"151MINSUB003_1.jpg","08/20/2014","08/20/2014","Photo: Minneapolis Convention & Visitors Bureau","Downtown Minneapolis, Minn., draws young professionals.",,
"151SUBPAL003_2.jpg","08/20/2014","08/20/2014","Photo: Don DeBold","Palo Alto Duck Pond in Palo Alto, Calif., is a great place for families.",,
"151SUBROY011.JPG","08/20/2014","08/20/2014","Photo: Royal Oak Chamber of Commerce","Royal Oak, Mich., hosts the Santa Scamper Fun Run before the city's annual Holiday Magic Parade.",,"Royal Oak"
"151SUBPAL002.jpg","08/20/2014","08/20/2014","Photo: Ho John Lee","The Palo Alto Festival of the Arts has a kids' art studio that features chalk, paint, clay and other supplies.",,
"3051009jkk6314_0.jpg","06/22/2017","08/20/2014","Photo: Staff Photographer","Brentwood, Tenn., kids enjoy playing at the 40-acre Concord Park, which also includes walking and biking trails.",,
"151SUBCAR013.jpg","08/20/2014","08/20/2014","Photo: Hamilton County Tourism Inc.","The Waterpark at the Monon Community Center in Carmel, Ind., has water slides, a lazy river, a lap pool and more.",,"Carmel"
"151SUBPLA008.jpg","08/20/2014","08/20/2014","Photo: Edmonson Photography","The Amphitheater at Oak Point Park in Plano, Texas, hosts family-friendly concerts and events.",,"Plano"
"151SUBCED099.jpg","08/20/2014","08/20/2014","Photo: City of Cedar Rapids","Prairie Park Fishery in Cedar Rapids, Iowa, offers kayaking, fishing and scuba diving.",,"Cedar Rapids"
"151SUBOVE001.jpg","08/20/2014","08/20/2014","Photo: City of Overland Park","Overland Park's Matt Ross Community Center features swimming pools, a three-story playground and other amenities.",,"Overland Park"
"151SUBDOW012.jpg","08/20/2014","08/20/2014","Photo: Richard Roche","The annual Downers Grove July 4th Parade is one of the city's most popular family-friendly events.",,"Downers Grove"
"151SUBBOI004.jpg","08/20/2014","08/20/2014","Photo: Seth Lemmons","Downtown Boise's Grove Fountain draws kids and families looking to cool off during warm-weather months.",,
"68210SUB070_4.jpg","08/20/2014","08/20/2014","Lesley Dixon","Peck's Lake Challenge Sprint Triathlon","Peck's Lake Challenge Sprint Triathlon includes a half-mile swim, a 9-mile bike ride, and a 3-mile run.","Johnstown"
"68210SUB070_3.jpg","08/20/2014","08/20/2014","Lesley Dixon","Peck's Lake Challenge Sprint Triathlon","Peck's Lake Challenge Sprint Triathlon includes a half-mile swim, a 9-mile bike ride, and a 3-mile run.",
"6820214MJC0168_1.jpg","08/20/2014","08/20/2014","Michael Conti","The Table at Fort Plain in Fort Plain, NY","The Table at Fort Plain is one of the top restaurants in Fulton County, NY.",
"6820813WJO9784_1.jpg","08/20/2014","08/20/2014","Staff Photographer","Riverlink Park in Downtown Amsterdam, NY","The Riverlink Park in downtown Amsterdam, NY, brings people down to the canal to dock their boats, walk their dogs and enjoy concerts.",
"6820813WJO9784_2.jpg","08/20/2014","08/20/2014","Staff Photographer","Riverlink Park in Downtown Amsterdam, NY","The Riverlink Park in downtown Amsterdam, NY, brings people down to the canal to dock their boats, walk their dogs and enjoy concerts.","Johnstown"
"6820214MJC0520 1_0.jpg","08/20/2014","08/20/2014","Michael Conti","Mohawk Valley Eye Surgery Center in Amsterdam, NY","Dr. Kwiat serves patients at the Mohawk Valley Eye Surgery Center in Amsterdam, NY.",
"6820214MJC0520 1_1.jpg","08/20/2014","08/20/2014","Michael Conti","Mohawk Valley Eye Surgery Center in Amsterdam, NY","Dr. Kwiat serves patients at the Mohawk Valley Eye Surgery Center in Amsterdam, NY.","Gloversville"
"68210SUB011_6.jpg","08/20/2014","08/20/2014",,"Flame the Band in Fulton County, NY","Flame, made up of individuals with disabilities, performs in concerts around the U.S.","Johnstown"
"6820809THB0193_6.jpg","08/20/2014","08/20/2014","Todd Bennett","FAGE","The exterior of FAGE Dairy in Johnstown, NY. FAGE invested $85 million in order to manufacture FAGE Total in this highly automated, state-of-the-art plant.","Johnstown"
"6820113MBC5791_1.jpg","07/30/2017","08/20/2014",,"Parillo's Armory Grill","Interiors of Parillo's Armory Grill in Amsterdam.","Gloversville"
"6821110JWA8637_1.jpg","08/20/2014","08/20/2014","Jeff Adkins","Bellwhether Ceramic Studio in Fulton County, NY","Bellwhether Ceramic Studio in Fulton County, New York is one of many studios in the area that celebrates the arts.","Johnstown"
"7970212BM2896.jpg","07/27/2017","08/20/2014","Brain McCord","Jasper, AL","Golfing in Prattville, AL.","Jasper"
"6820214MJC0462_1.jpg","08/20/2014","08/20/2014","Michael Conti","HFM BOCES Career & Technical Center in Johnstown, NY","Students can take engineering technology classes at the HFM BOCES Career & Technical Center in Johnstown, NY.",
"6820214MJC0462_2.jpg","08/20/2014","08/20/2014","Michael Conti","HFM BOCES Career & Technical Center in Johnstown, NY","Students can take engineering technology classes at the HFM BOCES Career & Technical Center in Johnstown, NY.","Johnstown"
"79701SUB006.jpg","08/20/2014","08/20/2014","Submitted","First United Methodist Church in Walker County, Alabama","First United Methodist Church in Walker County, Alabama is constructed of Georgia White Marble and is noted for its beautiful stained glass dome over the sanctuary. The church was built in 1921 and is listed on the National Register of Historic Places.","Jasper"
"7970412AB5566.jpg","08/20/2014","08/20/2014","Antony Boshier","Carl Elliot House Museum","Carl Elliot House Museum in Japser Alabama.","Jasper"
"79702SUB020.jpg","08/20/2014","08/20/2014","Submitted","Horse Creek","Horse Creek is a beautiful 18 hole course located in between Jasper and Birmingham, Alabama.","Jasper"
"7970212BM2824.jpg","08/20/2014","08/20/2014","Brian McCord","Bankhead House","The Bankhead House and Heritage Center in Jasper, Alabama.","Jasper"
"7970412AB5571.jpg","08/20/2014","08/20/2014","Antony Boshier","Black Rock Bistro","Signage outside Black Rock Bistro.  Black Rock Bistro is a Restaurant just off the square in Jasper Alabama.","Jasper"
"79702SUB035.jpg","08/20/2014","08/20/2014","Submitted","Alabama Power","Alabama Power","Jasper"
"7970412AB5533.jpg","08/20/2014","08/20/2014","Antony Boshier","Bernard's Store for Men","Rusty Richardson owner of Bernards Store for Men measures Jack Norris for a jacket.  Bernards Store for Men is located on the square in Jasper Alamama","Jasper"
"7970212BM2659.jpg","08/20/2014","08/20/2014","Brian McCord","Posey and Son General Store","Antique items at Posey and Son General Store in Jasper.","Jasper"
"75904SUB028_0.jpg","08/20/2014","08/20/2014",,"Miss Mississippi Pageant in Vicksburg, MS","The Miss Mississippi Pageant takes place at the Vicksburg Convention Center.","Vicksburg"
"759WJO02140164_0.jpg","08/20/2014","08/20/2014","Staff Photographer","Vicksburg National Military Park in Vicksburg, MS","The Vicksburg National Military Park commemorates the tide-turning battle that took place in the hills of Vicksburg during the Civil War.","Vicksburg"
"759WJO02140300_0.jpg","08/20/2014","08/20/2014","Wendy Jo O'Barr","Local Flavor","Walnut Hills is a local favorite in Vicksburg, MS.  The menu includes such Southern classics as Cayenne-laced Fried Chicken, Pan Roasted Pork Filets, and Coconut Cream Pie.","Vicksburg"
"7590913MJC0019_0.jpg","08/20/2014","08/20/2014","Michael Conti","Vicksburg National Military Park","Statue of Stephen C. Burbridge at Vicksburg National Military Park in Vicksburg, Mississippi, Warren County.","Vicksburg"
"75904SUB037.jpg","08/20/2014","08/20/2014","submitted","Birding late afternoon in August","Tara Wildlife. Birding late afternoon in August","Vicksburg"
"75904SUB021.jpg","08/20/2014","08/20/2014","Watermark Golf/Nathan Crace Design","Clear Creek Golf Course","Clear Creek Golf Course","Vicksburg"
"759WJO02141016_0.jpg","08/20/2014","08/20/2014","Staff Photographer","Promise Hospital of Vicksburg in Vicksburg, MS","Promise Hospital of Vicksburg is a long-term acute care hospital that offers patients specialized care and extensive therapy.","Vicksburg"
"759WJO02141150_0.jpg","08/20/2014","08/20/2014","Staff Photographer","The Attic Gallery in Downtown Vicksburg, MS","The Attic Gallery features contemporary art, crafts and more in downtown Vicksburg.","Vicksburg"
"81401SUB055.jpg","08/20/2014","08/20/2014",,"Downtown Tinley Park, IL","Downtown Tinley Park hosts a variety of family-friendly events, including weekly summer concerts.","Homewood"
"81401SUB026.jpg","08/20/2014","08/20/2014","Photo courtesy of Dennis Wierzbicki","Chicago Fire Soccer Team in Chicago, IL","The Chicago Fire soccer team, part of the Major League Soccer organization, is named for the Great Chicago Fire of 1871.","Homewood"
"81401SUB057.jpg","08/20/2014","08/20/2014",,"Frankfort Fall Festival in Frankfort, IL","The Frankfort Fall Festival features more than 300 artisans, live entertainment, a carnival and more.","Homewood"
"8140216fo8602.jpg","08/20/2014","08/20/2014","Frank Ordonez","Flossmoor Station Restaurant and Brewery in Flossmoor, IL","Flossmoor Station Restaurant and Brewery offers a large beer selection, with both seasonal and year-round options available.","Homewood"
"8140216fo8109_2.jpg","08/20/2014","08/20/2014","Frank Ordonez","Illinois Central Rail Cars in Homewood, IL","Two retired Illinois Central rail cars – a locomotive and caboose – are on display in Homewood.","Homewood"
"8140214MJC3076.jpg","08/20/2014","08/20/2014","Michael Conti","Mi-Jack in Hazel Crest, IL","Based in Hazel Crest, Mi-Jack now has more than 2,000 employees.","Homewood"
"81401SUB139_3.jpg","08/20/2014","08/20/2014",,"Governors State University in University Park, IL","Surrounded by a sculpture park, Governors State University offers 28 four-year degrees, 28 master’s degrees, five doctoral programs and 23 certificate programs.","Homewood"
"81401SUB082.jpg","08/20/2014","08/20/2014",,"MetroSouth Medical Center in Blue Island, IL","The 330-bed MetroSouth Medical Center now includes an in-patient unit serving senior patients with memory, mood and mental health issues.","Homewood"
"8140216fo7805.jpg","08/20/2014","08/20/2014","Frank Ordonez","Snackville Junction in Evergreen Park, IL","Model trains deliver baskets of food to diners at Snackville Junction.","Homewood"
"7590311BM8875.jpg","08/20/2014","08/20/2014","Brian McCord","Riverfront Murals","A mural titled President McKinley Visits the ""Land of Cotton."" Part of Vicksburg Riverfront Murals.","Vicksburg"
"759WJO02140477_0.jpg","08/20/2014","08/20/2014","Staff Photographer","The Senior Center in Vicksburg, MS","Vicksburg's Senior Center offers programs and activities for seniors looking to learn new skills and socialize.","Vicksburg"
"759WJO02140608_0.jpg","08/20/2014","08/20/2014","Staff Photographer","U.S. Army Engineer Research and Development Center","The U.S. Army Engineer Research and Development Center is headquartered in Vicksburg, MS.","Vicksburg"
"151SUBDEN016.jpg","08/20/2014","08/20/2014","Photo courtesy of Joel Mann","According to architect Joshua Prichard, the Denver Public Library is one of the buildings Godzilla should stomp out next.",,
"151SUBPOR015.jpg","08/20/2014","08/20/2014","Photo courtesy of David Grant","Portland, Ore., is home to an Airbnb headquarters, and the company has launched its first “Shared Cities” initiative here.",,
"151SUBRAL001.jpg","08/20/2014","08/20/2014","Photo courtesy of James Willamor","Fayetteville Street in downtown Raleigh, N.C., includes restaurants, entertainment venues and more.",,
"151SUBEAS013.jpg","08/20/2014","08/20/2014","Photo courtesy of Barry Halkin of Halkin Mason Photography","Lafayette College Arts Plaza in Easton, Pa., is a 7,000-square-foot outdoor arts space.",,
"151SUBLON012.JPG","08/20/2014","08/20/2014","Photo courtesy of the City of Long Beach","The Solar Grand Prix, held at El Dorado Park in Long Beach, Calif., draws hundreds of local students.",,
"151SUBMUR011_0.jpg","08/20/2014","08/20/2014","Photo courtesy of Matt Falwell/Gear Up Cycles","“Fix-it” stations in Murray, Ky., are making it easier than ever for cyclists to repair their bikes.",,
"151SUBSIN010_1.JPG","08/20/2014","08/20/2014","Photo courtesy of Dr. Tim Beatley","Khoo Teck Puat Hospital is one of the reasons Singapore is a model of the biophilic movement.",,
"151SUBLIV014.jpg","08/20/2014","08/20/2014","Photo courtesy of Digital Bookmobile","Since it began its national tour in 2008, the Digital Bookmobile has welcomed 150,000 readers of all ages.",,
"3471112MBC8385.jpg","08/20/2014","08/20/2014","Staff Photo","LED street lighting is changing the look of cities across the U.S.",,
"151SUBLIV005_2.jpg","08/20/2014","08/20/2014","Photo courtesy of Martin Cathrae","The U.S. currently has more than 3,700 roundabouts, which are designed to keep traffic flowing smoothly.",,
"151SUBLIV002_0.jpg","08/20/2014","08/20/2014",,"Fun and unique flavor combinations are drawing customers to gourmet popsicle shops.",,
"1280107GLE0002.jpg","08/20/2014","08/20/2014","Staff Photo","Restorative justice focuses on the offender, the victim and the community, and works to repair any harm done.",,
"64309ARCH236.jpg","08/20/2014","08/20/2014","Staff Photo","Several U.S. cities are prohibiting the use of fireworks, and violators are being fined.",,
"151SUBLIV007_0.jpg","08/20/2014","08/20/2014","Photo courtesy of Lara Cores","The Coffee Shop Guy is just one of eight guys you'll see in every city.",,
"3500408IC0107_0.jpg","08/20/2014","08/20/2014","Staff Photo","The GRADUATE! program in North Carolina's Johnston County Schools district is improving its graduation rates.",,
"151SUBPAN006.jpg","08/20/2014","08/20/2014","Photo courtesy of Brent Moore","Panama City Beach, Fla., has a reputation for being a popular Spring Break destination for college students.",,
"151SUBHAT009.jpg","08/20/2014","08/20/2014",,"Longleaf Trace is leading to improvements in Hattiesburg's downtown and metro area.",,
"151SUBHEA008.jpg","08/20/2014","08/20/2014",,"Located near Healdsburg, Calif., the Redwood Tree House is perfect for vacationers in need of a quiet retreat.",,
"151SUBKAL004.JPG","08/20/2014","08/20/2014","Photo courtesy of Alex Lee","Thanks to the Kalamazoo Promise, many area students are able to attend college for free.",,
"151SUBLIV003_2.jpg","08/20/2014","08/20/2014","Logo courtesy of Fincredit Inc.","The Property Tax Card helps residents save money on their property tax bills when they shop with participating merchants.",,
"2020509IC0112.jpg","08/20/2014","08/20/2014","Staff Photo","Charlotte Motor Speedway in Concord, N.C., is one of the area's most popular attractions.",,
"151SUBLIV005_1.jpg","08/20/2014","08/20/2014","Photo courtesy of Michael Paul Smith","Michael Paul Smith has created Elgin Park, a model small town complete with homes, businesses and vehicles.",,
"151SUBLIV017_0.jpg","08/20/2014","08/20/2014","Photo courtesy of Thomas Hawk","Google Glass is being used as a tourism tool in cities across the U.S.",,
