"name","post_modified","post_date","byline","alt_text","description","place_name"
"3040114JWA3666_1.jpg","08/20/2014","08/20/2014","Jeff Adkins","Plaza Theatre in Downtown Glasgow, KY","Downtown Glasgow's historic Plaza Theatre showcases live performances, lectures, meetings and other events.","Glasgow"
"3040114JWA2808_0.jpg","08/20/2014","08/20/2014","Jeff Adkins","Spotswood House in Glasgow, KY","The Spotswood House, one of the oldest homes in Glasgow, has recently been renovated and restored by Amelia and Kyle Kiser.","Glasgow"
"3040114JWA3867_0.jpg","08/20/2014","08/20/2014","Jeff Adkins","Leo's Crafts in Cave City, KY","Artist Leo Esters creates and sells wooden birdhouses, furniture and other items in Cave City, Kentucky.","Glasgow"
"151SUBOMA025_0.jpg","08/20/2014","08/20/2014","Photo: Taita","Taita offers sushi and seafood in Omaha, Neb., and is open for dinner Monday-Saturday.",,"Omaha"
"151SUBBUR012_0.jpg","08/20/2014","08/20/2014","Photo: Leunig's Bistro and Cafe","Leunig's Bistro and Cafe in downtown Burlington is known for its French fare and craft cocktails.",,
"151SUBBOU011_0.jpg","08/20/2014","08/20/2014","Photo: Julia Vandenoever","Boulder's Frasca Food and Wine serves Italian cuisine and has a selection of more than 200 wines.",,"Boulder"
"151SUBBER024.jpg","08/20/2014","08/20/2014","Photo: Drake's","Jupiter in downtown Berkeley, Calif., draws customers with wood-fired pizzas and several beers and ales.",,"Berkeley"
"151SUBTRA019.JPG","08/20/2014","08/20/2014","Photo: Poppycock's","Poppycock's offers New American cuisine, such as sesame tuna, as well as homemade desserts.",,"Traverse City"
"Asheville_NC_Curate_Restaurant.jpg","08/10/2016","08/10/2016","Evan Sung","Asheville NC Restaurants: Curate",,"Asheville"
"151SUBBOS010.jpg","08/20/2014","08/20/2014","Photo: Susie Cushner","B&G Oysters in Boston, Mass., is known for its fresh and flavorful seafood dishes, including lobster rolls.",,"Boston"
"151SUBSCO016_0.jpg","08/20/2014","08/20/2014","Photo: Scottsdale Convention & Visitors Bureau","Diners at The Mission in Scottsdale can enjoy tableside guacamole and a broad selection of Latin fare.",,"Scottsdale"
"151SUBNEW026.jpg","08/03/2017","08/20/2014","Courtesy of Bob Potter","New Haven, CT","Prime 16 is favorite burger and craft beer destination in New Haven, CT.","New Haven"
"151SUBASH001.jpg","07/14/2014","07/14/2014","Photo: Christopher Shane","Curate helps make Asheville, N.C., one of the Top 10 Foodie Cities for 2014.",,
"151NEWNEWSSUB_01.jpg","06/20/2014","06/20/2014","Newport News Tourism Development Office","City Center at Oyster Point in Newport News, VA","City Center at Oyster Point in Newport News, VA","Newport News city"
"151LINSUB_01.jpg","06/20/2014","06/20/2014","Lincoln, Nebraska CVB","Lincoln, Nebraska Skyline","Lincoln, Nebraska Skyline","Lincoln"
"15WHITTISUB_01.jpg","06/20/2014","06/20/2014","City of Whittier","The MarVista Fountain in Whittier, CA","The MarVista Fountain in Whittier, CA","Whittier"
"151SUNSUB_01.jpg","06/20/2014","06/20/2014","© 2006, City of Sunnyvale, all rights reserved. Permission granted to VTA for reproduction.","Murphy Avenue in downtown Sunnyvale, California.","Murphy Avenue in downtown Sunnyvale, California.","Sunnyvale"
"151PLASUB_01.jpg","06/20/2014","06/20/2014","Plano Convention and Visitors Bureau","Plano Balloon Festival in Plano, Texas.","Plano Balloon Festival in Plano, Texas.","Plano"
"151REDSUB_01.jpg","06/20/2014","06/20/2014","Photo © 2010 ESRI","Redlands Market Night in Redlands, California.","Redlands Market Night in Redlands, California.","Redlands"
"151LAKSUB_01.jpg","06/20/2014","06/20/2014","City of Lakewood","Belmar in Lakwood, Colorado.","Belmar in Lakwood, Colorado.","Lakewood"
"San_Rafael_CA.jpg","06/20/2017","06/20/2014","Courtesy of TJ Gehling under a  CC 2.0  license.","San Rafael, CA.","Richmond–San Rafael Bridge in San Rafael, California.","San Rafael"
"151HAYSUB_01.jpg","06/27/2017","06/20/2014","Courtesy of Jennifer Williams under a  CC 2.0  license.","City of Hayward, California.","City of Hayward, California.","Hayward"
"151SANTAANASUB_01.jpg","06/20/2014","06/20/2014","Santa Ana Magazine","Santoro Blvd in Santa Ana, California.","Santoro Blvd in Santa Ana, California.","Santa Ana"
"151ORASUB_01.jpg","06/20/2014","06/20/2014","Anaheim/Orange County Visitor & Convention Bureau","Old Towne Orange in Orange, California.","Old Towne Orange in Orange, California.","Orange"
"151HELSUB_01.jpg","06/20/2014","06/20/2014","Helena Tourism Alliance","City of Helena, Montana","City of Helena, Montana","Helena"
"151MURRSUB_01.jpg","06/20/2014","06/20/2014","courtesy of the City of Murray","City of Murray, UT","City of Murray, UT","Murray"
"151SUBWAS022.jpg","06/24/2014","06/24/2014","Elizabeth Parker","Located on Capitol Hill, Rose's Luxury serves a mix of small dishes and family-style meals.",,"Washington"
"6811004GE1396_1_6.jpg","08/20/2014","08/20/2014","Greg Emens","Farmer’s Markets","Farmer’s Markets are popping up everywhere.","Tucson"
"Andrew_Whisenant_2011_0.jpg","06/27/2014","06/27/2014",,,,
"Dan_Hieb.jpg","06/27/2014","06/27/2014",,,,
"Gary Wollenhaupt.jpg","07/07/2014","07/07/2014",,,,
"Stephanie Stewart-Howard_NEW.jpg","07/10/2014","07/10/2014",,,,
"PRCHSTKE000390C.jpg","07/10/2014","07/10/2014",,"How to Pack Your Stuff for a Move","Learn how to effectively pack your belongings as you prepare to move to a new home.",
"2020411THB0368.jpg","07/10/2014","07/10/2014","Staff Photo","How to Pack Your Kitchen: Tips on Moving Dishes, Glassware, Appliances and More","Keep kitchen appliances, dishes and cookware safe and undamaged as you move.",
"7450808JWA2034.jpg","07/10/2014","07/10/2014","Jeff Adkins","How to Move Your Pets: Tips on Moving With Dogs, Cats and More","Find out how to help pets stay calm and happy as your family prepares to move and adjusts to a new living space.",
"1521010jso1332.jpg","07/10/2014","07/10/2014","Jeffrey S. Otto","How to Move Your Plants: Tips for Moving Garden and Indoor Plants","Don't let the moving process kill what your green thumb has cultivated. By following a few easy tips, you can keep your plants alive as you relocate.",
"PRCHSTK26143.jpg","07/10/2014","07/10/2014",,"Buying an Older Home: Are You Ready for a Fixer-Upper?","Find out if you're prepared to commit to the work a major home renovation typically requires.",
"PRCHSTK83115159.jpg","07/10/2014","07/10/2014",,"Six Tips to Find the Best Realtor/Real Estate Agent for You","Start your home search off right by learning how to select the best realtor for you and your family.",
"PRCHSTK26225.jpg","07/10/2014","07/10/2014",,"10 Lawn and Garden Tips for First-Time Homeowners","Find out how to grow and maintain a beautiful yard, and discover easy tips for growing vegetables and flowers.",
"PRCHSTKE000304C.jpg","07/10/2014","07/10/2014",,"Painting Your Home: How Color Creates Atmosphere","Paint can take your home from drab to fab, but it can be difficult to know which colors to use. Begin the selection process by learning how paint can influence your home's temperature and overall vibe.",
"6470408thb5021_0.jpg","08/20/2014","08/20/2014","Todd Bennett","Kankakee County Historical Museum in Illinois","The Kankakee County Historical Museum in Kankakee features permanent exhibits, temporary galleries, display cases and photographs.","Kankakee"
"6470408thb5063addbackground_1.jpg","08/20/2014","08/20/2014","Todd Bennett",,"One of several Abraham Lincoln studies created by George Grey Barnard on display at the Kankakee County Historical Museum.","Kankakee"
"6470605AJB6938_0.jpg","08/20/2014","08/20/2014","Antony Boshier",,"Kohl's part of the Bradley Commons development","Kankakee"
"6470605AJB7184_1.jpg","08/20/2014","08/20/2014","Antony Boshier","Horseback Riding at Camp Shaw-Waw-Nas-See",,"Kankakee"
"Asheville_NC_Shopping.jpg","08/10/2016","08/10/2016","Staff","Asheville, NC Shopping","Asheville, NC offers a variety of retail opportunities, including boutiques, shopping malls and antique shops.","Asheville"
"3780306BM2154_0_0.jpg","08/20/2014","08/20/2014","Brian McCord","Main Street","Original caption: Main Street, Abingdon, Virginia","Abingdon"
"73808SUB20003_2.jpg","08/20/2014","08/20/2014","Submitted","Western Heritage Classic Ranch Rodeo",,"Abilene"
"IAIL03_E28_1.jpg","08/20/2014","08/20/2014",,"Mastodon Lake in Aurora, IL","A bike trail in Phillips Park sits along the bank of Mastodon Lake in Aurora.",
"IAIL03_E23_1.jpg","08/20/2014","08/20/2014","Staff Photo","Provena Mercy Center in Aurora, IL",,
"151ATH0808IC_0007_0_1.jpg","08/20/2014","08/20/2014","Ian Curcio","Athens Regional Medical Center","Athens Regional Medical Center has won the Hospital of the Year award given out by the Georgia Alliance of Community Hospitals.",
"151AND0708IC0022_0_4.jpg","08/20/2014","08/20/2014","Ian Curcio","Anderson County Arts Center","Anderson County Arts Center has one gallery housed in a historic Carnegie building and another at its Arts Warehouse location, which also offers pottery classes for adults and summer art camps for kids.","Anderson"
"Asheville_NC_Grand_Bohemian_Hotel_Asheville.jpg","08/02/2017","08/11/2016","Ian Curcio","Asheville NC Grand Bohemian Hotel Asheville","The Grand Bohemian Hotel in Asheville, NC has many beautiful interior rooms with sculptures.","Asheville"
"6330908BM9201_0.jpg","08/20/2014","08/20/2014","Brian McCord","Shopping in Amarillo, TX","Amarillo, TX has plenty of options to satisfy every shopper.","Amarillo"
"7130506BM0389_0_2.jpg","08/20/2014","08/20/2014","Brian McCord","Taking Care of Veterans","V.A. Medical Center is the primary hospital of the West Texas VA Health Care System in Big Spring, Texas.","Amarillo"
"6991209BM2589_2.jpg","08/20/2014","08/20/2014","Brian McCord","New Mexico Cuisine in Albuquerque, NM","Green Chile on a breakfast burrito with potatoes is an Albuquerque, NM favorite.",
"7551108JWA1980_0_1.jpg","08/20/2014","08/20/2014","Jeff Adkins","Akron Children's Hospital in downtown Akron, Ohio","Exterior photo of Akron Children's Hospital in downtown Akron, Ohio.  The 253-bed Akron Children's Hospital is the largest pediatric care provider in Northeast Ohio, treats more than 450,000 patients each year and performs more pediatric surgeries than any other hospital in the region.","Akron"
"6590608BM6383_0.jpg","08/20/2014","08/20/2014","Brian McCord",,"Albany Medical Center is preparing to embark on a $360 million expansion that will increase its bed count to nearly 750.","Albany"
"3591111THB0886_0.jpg","08/20/2014","08/20/2014","Todd Bennett","Early College High School at Randolph Community College in Asheboro, NC","Students work on a class assignment at the Early College High School at Randolph Community College in Asheboro, NC.","Asheboro"
"3591111THB1303_0.jpg","08/20/2014","08/20/2014","Todd Bennett","Carolina Bronze Statue in Seagrove, NC","A worker works on the seams of a statue at Carolina Bronze Statue in Seagrove, NC. The foundry specializes in bronze casting and the fabrication of sculptures created by artists throughout the United States.","Asheboro"
"3591210THB0109_0.jpg","08/20/2014","08/20/2014","Todd Bennett","Blue Mist Bar-B-Q in Asheboro, NC",,"Asheboro"
"3591107TB0320_1.jpg","08/20/2014","08/20/2014","Todd Bennett","North Carolina Aviation Museum in Asheboro, NC","An airplane is on display at the North Carolina Aviation Museum in Asheboro, North Carolina.","Asheboro"
"7551108JWA3918_2.jpg","08/20/2014","08/20/2014","Jeff Adkins","Brandywine Creek","Water from Brandywine Creek flows 60-feet over Brandywine Falls at Cuyahoga Valley National Park in Akron, Ohio. In addition to boasting high-quality regional and state parks, a gem in the form of Cuyahoga Valley National Park is minutes from downtown Akron and offers 33,000 acres of ravines, forest and waterways for hiking, biking, a railroad ride or enjoying nature.","Akron"
"7820810JWA6257.jpg","08/20/2014","08/20/2014","Jeff Adkins","Santana Row","Visitors walk past the storefronts at Santana Row, an upscale shopping and dining area located in San Jose, California.",
"7510908JWA7086_0.jpg","08/20/2014","08/20/2014","Jeff Adkins","Downtown Sheridan, WY","Downtown Sheridan houses plenty of stores for shopping fun.","Sheridan"
"10607SUB0737_0.jpg","08/20/2014","08/20/2014","Submitted","Shopping in Chattanooga, TN","Regardless of what you're searching for on your shopping trip – clothing, accessories, antiques, home furnishings or gifts – Chattanooga, TN has a district to meet your needs.","Chattanooga"
"6720209DBM0220_0_1.jpg","08/20/2014","08/20/2014","Brian McCord","Reed's of Columbus in Columbus, MS","Reed's of Columbus in Columbus, MS is a family-owned, upscale shopping destination.",
"3200411JWA3643.jpg","08/20/2014","08/20/2014","Jeff Adkins","Castle Toy Store in Downtown Columbia","A great selection of toys, games and candy are for sale at Castle Toy Store in downtown Columbia, Tennessee. With recent street scape improvements, restaurants like Copper Kettle, Square Market, Killion's Coffee and Creamery, and specialty shops like Castle Toy Store are bringing renewed vigor back to the downtown area.","Columbia"
"6020510AB2248.jpg","06/19/2017","08/20/2014",,"Lane Home Furnishings in Tupelo, MS","Lane Home Furnishings is part of the manufacturing sector in Tupelo, MS.",
"6600108IC0038_0.jpg","08/20/2014","08/20/2014","Ian Curcio","Charlottesville Downtown Mall","A downtown shopper checks out books at Read It Again, Sam, which is located on the Downtown Mall.","Charlottesville"
"7740510THB0877_0_0.jpg","08/20/2014","08/20/2014","Todd Bennett","Sisters of Camden","The Sisters of Camden boutique, in Camden, SC, opened in 2008, and features ladies' clothing by Joseph Ribkoff and Not Your Daughter's Jeans. The shop is owned by stepsisters Pam Herlong and Linda Branham, and offers stylish clothing that includes all types from casual to evening wear.","Camden"
"151BLO0708kmy4424_1.jpg","08/20/2014","08/20/2014","Kevin Young","Talbots","Talbots is one of many retailers located downtown on College Avenue.","Bloomington"
"3501111THB0387.jpg","10/14/2014","10/14/2014","Todd Bennett","Wilkes Regional Medical Center.","Wilkes County offers its residents high-quality health care through the community-owned Wilkes Regional Medical Center. The fully accredited, 130-bed hospital offers a range of physician services, from cardiology to internal medicine to pediatrics.","Wilkesboro"
"3500408IC0109_0.jpg","08/20/2014","08/20/2014","Ian Curcio","Wilkes Community College","a",
"151BLO0708kmy4452_0_0.jpg","08/20/2014","08/20/2014","Kevin Young","Samira's Restaurant","Samira's Restaurant serves up Afghanistan dishes such as kebabs and rack of lamb from its Sixth Street location dowtnown.","Bloomington"
"7810910THB0810.jpg","08/20/2014","08/20/2014","Todd Bennett","National D-Day Memorial in Bedford, VA","This 88-acre memorial is divided into plazas that tell the story of the invasion.","Bedford"
"6690407GLE0076_0_1.jpg","08/20/2014","08/20/2014",,"Calvert Crossing golf course on the Audubon Golf Trail","This distinct group of golf courses has been earmarked for out-of-state golfers to play whenever they visit the state.","West Monroe"
"3951208THB3772_2.jpg","08/20/2014","08/20/2014",,,,"West Chester"
"3951208THB0125_2.jpg","08/20/2014","08/20/2014",,,,"West Chester"
"3950809THB0545_0.jpg","08/20/2014","08/20/2014",,,,"West Chester"
"3950809THB0636_1.jpg","08/20/2014","08/20/2014",,,,"West Chester"
"39502ARCHE12B_2.jpg","08/20/2014","08/20/2014",,,,"West Chester"
"6321007jwa6540_2.jpg","07/27/2017","08/20/2014","Jeff Adkins","Wausau, WI",,"Wausau"
"6321208jkk8874_3.jpg","08/20/2014","08/20/2014","J. Kyle Keener","Granite Peak Ski Area","Ski School Director Chris Pingel, of Wausau, gets some air on his snowboard at the Birch Run Turrain Park at Granite Peak Ski Area, at Wausu's Rib Mountain State Park.","Wausau"
"ICRI04.ED13A__1.jpg","08/20/2014","08/20/2014",,"Goddard Memorial State Park","Goddard Memorial State Park is Rhode Island's most popular Metropolitan Park.","Warwick"
"ICRI04.ED7__0.jpg","08/20/2014","08/20/2014",,"Gaspee Days","The annual Gaspee Days celebration takes place in Pawtuxet Village","Warwick"
"ICRI04.ED21_.jpg","08/20/2014","08/20/2014",,"Central Rhode Island Counts on Kent Hospital",,"Warwick"
"7320808jk4476_142_1.jpg","08/20/2014","08/20/2014","Staff Photo",,,"Waco"
"7320808jk6095_0.jpg","08/20/2014","08/20/2014","Jesse Knish","Texas State Technical College in Waco","Texas State Technical College in Waco offers more than 100 technical associate degree and certificate programs along with holding strong partnerships with business and industry.","Waco"
"7490609jkk7655_2.jpg","08/20/2014","08/20/2014","J. Kyle Keener","""The Trail Where They Cried""","The bronze statue titled ""The Trail Where They Cried"" portrays a Cherokee family walking west on the Trail of Tears that crossed near Pulaski in 1838 during the forced removal of Native Americans to the west. The new statue sits at the site of the Traill of Tears Interpretive Center, located at 220 Stadium Street, in Pulaski.","Pulaski"
"3571009THB0362_1_1.jpg","08/20/2014","08/20/2014","Todd Bennett","Veteran's Center at Becker Village Mall","Memorabilia is on display at the Veteran's Center at Becker Village Mall in Roanoke Rapids, NC. The center honors those from Halifax County, as well as those who have ties to the community.","Roanoke Rapids"
"3450610THB0537.jpg","08/20/2014","08/20/2014","Todd Bennett",,"Headquartered in Rocky Mount, NC, Boddie-Noell Enterprises Inc. is a diversified, family-owned company with interests in a variety of restaurant and land-development projects.","Rocky Mount"
"7360708jk9504_0.jpg","08/20/2014","08/20/2014","Jesse Knish","Grin's","Grin's is a local hangout in San Marcos and is known for their Tex-Mex and Happy Hour specials.","San Marcos"
"7120209THB1244_0_2.jpg","08/20/2014","08/20/2014","Todd Bennett",,"Hallie Ford Museum of Art is located on the campus of Historic Willamette University in Salem, OR.","Salem"
"151BEN0708JWA7756_1.jpg","08/20/2014","08/20/2014","Jeff Adkins","Dog-Friendly San Angelo, TX","Dog-Friendly San Angelo, TX","San Angelo"
"151SUB001_1.jpg","08/20/2014","08/20/2014","Photo courtesy of Stephen McCabe",,"Flowers at the University of California - Santa Cruz Arboretum.","Santa Cruz"
"151OCA0608KMY0343_0_0.jpg","08/20/2014","08/20/2014","Kevin Young","Ocala Regional Medical Center","Ocala Regional Medical Center was named among HealthGrades America’s 50 Best Hospitals.","Ocala"
"Franklin_TN_Community_Health_Systems_Corporate.jpg","08/10/2016","08/10/2016","Staff","Franklin TN Community Health Systems Corporate","Franklin, TN is home to the corporate office of Community Health Systems Inc.","Franklin"
"6720405AB0297.jpg","08/20/2014","08/20/2014","Antony Boshier","Memorial Day","Original caption: The first Memorial Day reportedly was observed at Friendship Cemetery on April 25, 1866.
JCI PHOTO- Antony Boshier",
"7341208THB3060_1_1.jpg","08/20/2014","08/20/2014","Todd Bennett","The Alamo","The Alamo","San Antonio"
"fort_0_1.jpg","08/20/2014","08/20/2014",,"Fort Dobbs",,"Statesville"
"Chicken_Salad_0_2.jpg","08/20/2014","08/20/2014",,,,"Statesville"
"springfield2_3.jpg","08/20/2014","08/20/2014",,"The Muni's Lakeside Ampitheatre","Aida was one of the many terrific performances at The Muni, which entertains audiences with the best of Broadway musicals.","Springfield"
"TucSUBMW_2.jpg","08/20/2014","08/20/2014","Michael Wifall","Finger Rock Trail in Tucson, AZ","Finger Rock Trail in Tucson, AZ.Photo courtesy of",
"IBCMD04.ED29__0.jpg","08/20/2014","08/20/2014",,"Johns Hopkins Bayview Medical Center",,"Towson"
"6000507AJB5756.jpg","07/31/2017","08/20/2014","Antony Boshier",,,"Titusville"
