"name","post_modified","post_date","byline","alt_text","description","place_name"
"20207ARCHED8283.jpg","12/08/2015","12/08/2015",,"Statue of a man holding up a baby at the corner of Trade and Tryon in downtown Charlotte.",,"Charlotte"
"Snow Geese in Delaware","12/09/2015","12/09/2015","Courtesy of www.GlynLowe.com under a  CC 4.0  license.","Colorful snow geese flying in a flock","Flocks of snow geese are a part of the beautiful scenery found in Delaware.","Delaware"
"18001SUB053.jpg","12/09/2015","12/09/2015","Courtesy of Oregon Blueberry Commission","Mount Hood is visible behind ripe blueberry bushes on a sunny, partly cloudy day.","Mount Hood stands out behind a pair of blueberry bushes.","Oregon"
"2080811THB0311.jpg","12/09/2015","12/09/2015","Todd Bennett","People ride bikes, walk and jog on a cement trail lined by black metal fence in Columbia, SC.","Outdoor enthusiasts enjoy a late afternoon along the Riverwalk in Columbia, SC.","Columbia"
"milfordlightening.jpg","12/09/2015","12/09/2015","Courtesy of Jerry Angelica under a  CC 4.0  license.","Lightning comes down from a red sky to the ocean in this view from a beach in Milford, CT",,"Milford"
"rsz_anchorage_ak.jpg","12/09/2015","12/09/2015","https://en.wikipedia.org/wiki/Anchorage,_Alaska",,"Anchorage skyline","Anchorage"
"hotspringscolo.jpg","12/09/2015","12/09/2015","Matt Inden/Miles","People wade in the hot springs at Ouray Hot Springs, which is surrounded by snow-capped mountains.",,"Colorado"
"Country Ham Fest-2014-1.JPG","12/10/2015","12/10/2015","Courtesy of City of Spring Hill, TN","People walk in front of a row of tents and booths at the Country Ham Festival in Spring Hill, TN",,"Spring Hill"
"Florida skyline.jpg","05/03/2017","01/13/2016","Courtesy of George Clark under a  CC 4.0  license.","Tallahassee FL",,"Tallahassee"
"Great-American-Ball-Park.jpg","12/10/2015","12/10/2015","Courtesy of the Cincinnati Convention and Visitors Bureau",,,
"Cincinnati-skyline-from-kentucky-shore-night.jpg","12/10/2015","12/10/2015","Derek Jensen. Public domain.",,,"Cincinnati"
"Great-American-Ball-Park.jpg","12/10/2015","12/10/2015","Courtesy of the Cincinnati Convention and Visitors Bureau",,,
"Cincinnati-Reds-Hall-of-Fame-and-Museum-Credit-Cincinnati-Reds-Hall-of-Fame.jpg","12/10/2015","12/10/2015","Courtesy of the Cincinnati Reds Hall of Fame and Museum",,,
"iStock_000026448952_Double.jpg","12/15/2015","12/15/2015","istock.com/MarcelC","The United States as seen from space with the Milky Way Galaxy behind a dark blue earth.",,
"Tulips.jpg","12/15/2015","12/15/2015","Courtesy of Holland Visitors Bureau","A wooden windmill overlooks a field of bright yellow and pink tulips in Holland, MI.",,"Holland"
"Abilene aerial WEB.jpg","12/15/2015","12/15/2015","courtesy of whitesphotography.com","Aerial view of downtown Abilene, TX",,"Abilene"
"20219SUB047.jpg","12/16/2015","12/16/2015","Courtesy of Chapel Hill/Orange C","Students and fans cross an intersection in Chapel Hill, NC under a Tar Heels flag.",,"Chapel Hill"
"Carrboro.jpg","12/16/2015","12/16/2015",,"A car drives down a street in historic Carrboro, NC",,"Carrboro"
"20208SUB4598.jpg","12/16/2015","12/16/2015",,"Street lights cast a golden glow on cars and buildings along Elm Street in downtown Greensboro, NC",,"Greensboro"
"Wyoming Mountain Scene.jpg","08/24/2017","12/16/2015","Courtesy of Robert Levy under a  CC 4.0  license.","The mountains, clouds and interesting landscapes are part of the beauty of Wyoming","Wyoming's natural beauty is among its many attractions.","Wyoming"
"Lincoln_Presidential_Museum.jpg","03/03/2017","12/17/2015","Courtesy of Randy von Liski under a  CC 4.0  license.","People giving speeches at the Abraham Lincoln Presidential Museum in Springfield","The Lincoln Presidential Museum is one of many tourism attractions in Springfield.","Illinois"
"iStock_000048308844_Full.jpg","12/17/2015","12/17/2015","istock/Rawpixel Ltd","A cruise ship floats in blue water between a beach and an island.",,
"horses-dogs-moving_edited-1.jpg","12/17/2015","12/17/2015","istock/Alexia/Khrushcheva","A black dog sniffs the nose of a brown pony while a white pony watches in a green field.",,
"iStock_000048308844_Full_edited-1-logo.jpg","12/17/2015","12/17/2015",,,,
"Asheville_NC_Best_Place_to_Retire.jpg","08/10/2016","08/10/2016",,"Asheville is one of the Best Places to Retire in the US","Asheville, NC offers a variety of activities for retirees.","Asheville"
"Asheville_NC_Hi_Wire_Brewing.jpg","08/10/2016","08/10/2016","Jeff Adkins","Asheville NC Hi-Wire Brewing","Visitors enjoy beers at Hi-Wire Brewing's new Big Top location in Asheville, NC.","Asheville"
"Asheville_NC_French_Broad_River_Park_Greenway.jpg","08/10/2016","08/10/2016","Jeff Adkins","Asheville NC French Broad River Park Greenway","Asheville, NC's greenway system includes many pathways to bike and walk around the city.","Asheville"
"Asheville_NC_French_Broad_River.jpg","08/10/2016","08/10/2016","Staff","Asheville NC French Broad River","Kayakers paddle across the French Broad River in Asheville, NC during the Mountain Sports Festival.","Asheville"
"ash-golf.jpg","01/04/2016","01/04/2016","Brian McCord","A man hits a chip shot over a bunker on a golf course.",,
"Louisiana.jpg","03/09/2017","01/06/2016","Courtesy of finchlake2000 under a  CC 4.0  license.","Two shrimp boats in Louisiana",,"Louisiana"
"Kentucky.jpg","03/09/2017","01/06/2016","Courtesy of Tom Hinch under a  CC 4.0  license.","Corvette driving along",,"Kentucky"
"Indiana.jpg","02/27/2017","01/06/2016","Courtesy of Gbozik Photography under a  CC 4.0  license.","University of Notre Dame campus",,"Indiana"
"Deforest.JPG","01/06/2016","01/06/2016","Courtesy of vi.deforest.wi.us","Purple flowers block the view to Fireman's Park in Deforest, WI","Fireman's Park in the Village of DeForest, WI","DeForest"
"UW_Health_008.jpg","01/06/2016","01/06/2016","Courtesy of vi.deforest.wi.us","Officials in DeForest break ground for a new health center.",,"DeForest"
"water-deforest.jpg","01/06/2016","01/06/2016","Courtesy of vi.deforest.wi.us","Boy runs through the sprinklers at a splash pad in DeForest, WI.",,"DeForest"
"Kansas.jpg","06/04/2017","01/06/2016","Courtesy of Frank Thompson Photos under a  CC 4.0  license.","A Kansas reflective sign",,"Kansas"
"Fishing_on_the_Yahara_River.jpg","01/06/2016","01/06/2016","Courtesy of vi.deforest.wi.us","A man helps a small girl fish on the Yahara River in DeForest, WI",,"DeForest"
"sadkid-dog.jpg","01/07/2016","01/07/2016","istock.com/Chalabala","A young boy in a blue shirt looks sad as a dog watches him.",,
"OakRidge16v10W.jpg","01/12/2016","01/12/2016",,"Cover image for Oak Ridge, TN Magazine",,"Oak Ridge"
"oakridgeLOGO_vw.jpg","01/12/2016","01/12/2016",,"Oak Ridge Chamber of Commerce Logo",,"Oak Ridge"
"Maryland.jpg","03/28/2017","01/13/2016","Courtesy of scott1346 under a  CC 4.0  license.","A winter sunrise photo on the water in Maryland",,
"Maine.jpg","03/09/2017","01/13/2016","Courtesy of Chris Templeton under a  CC 4.0  license.","Nice canal waterway scene in Maine",,"Maine"
"fourdswinery.jpg","06/21/2017","01/13/2016","Courtesy of Four Daughters Vineyard & Winery","A group of people dines at a table outside at sunset at a vineyard.","People dine at Four Daughters Vineyard &amp; Winery on a warm summer evening.",
"destinationmedical.jpg","06/21/2017","01/13/2016","Courtesy of Destination Medical Center","A rendering shows what downtown Rochester could look like in the future.","With the Mayo Clinic at its heart, Destination Medical Center is a 20-year economic development initiative to position Rochester, MN as the world's leading destination for health and wellness.",
"Minnesota.jpg","03/17/2017","01/13/2016","Courtesy of Jim Brekke under a  CC 4.0  license.","Forest and water scene in Minnesota",,"Minnesota"
"Affordable_Cities_Lead.png","01/13/2016","01/13/2016",,"Best Affordable Cities",,
"Nebraska.jpg","03/09/2017","01/14/2016","Courtesy of Asten under a  CC 4.0  license.","A sea of red-clad fans at a Nebraska football game",,
"7880112AB7743.jpg","06/27/2017","01/14/2016","Antony Boshier",,,"Dalton"
"83101SUB021.jpg","01/14/2016","01/14/2016",,"Kentucky BioProcessing Inc. in Owensboro","Kentucky BioProcessing Inc. in Owensboro developed the experimental drug used to treat Americans infected with Ebola. The company provides scientific research and development in the expression, extraction and purification of plant proteins.","Owensboro"
"83101SUB029.jpg","01/14/2016","01/14/2016",,"Owensboro's riverfront","Owensboro's riverfront revitalization showcases the high quality of life, and rich arts and culture in the region.","Owensboro"
"Brew_Up_Great-Downtown.jpg","01/14/2016","01/14/2016",,"Beer Downtown",,
"9_Affordable_Cities_Topeka.jpg","01/14/2016","01/14/2016",,"Infographic for Topeka, KS showing why it's one of the most affordable cities.",,
"8_Affordable_Cities_Nampa.jpg","01/14/2016","01/14/2016",,"Infographic for Nampa, ID showing why it's a best affordable city","Infographic showing data points that helped Nampa rank as a best affordable city.",
"6_Affordable_Cities_Fort_Wayne.jpg","01/14/2016","01/14/2016",,"Infographic showing why Fort Wayne",,
"5_Affordable_Cities_Appleton copy.jpg","01/14/2016","01/14/2016",,,,
"4_Affordable_Cities_Lansing.jpg","01/14/2016","01/14/2016",,,"Infographic for Lansing, MI showing why it's one of the best affordable cities in 2015.",
"3_Affordable_Cities_Lawton copy.jpg","01/14/2016","01/14/2016",,"Lawton, OK affordable cities infographic","Infographic for Lawton, OK showing why it's a best affordable city.",
"2_Affordable_Cities_Dayton.jpg","01/14/2016","01/14/2016",,"Dayton, OH affordable city infographic",,
"1_Affordable_Cities_Round_Rock.jpg","01/14/2016","01/14/2016",,"Round Rock, TX affordable cities infogaphic",,
"7_Affordable_Cities_Rochester copy.jpg","01/14/2016","01/14/2016",,,,
"Move_For_Relationship.jpg","01/15/2016","01/15/2016",,"Long Distance Relationship Moving",,
"Fastest_Growing_Cities_For_Retirees.jpg","01/15/2016","01/15/2016",,"Fastest Growing Cities for Retirees",,
"Retirees_Stay_OrGo.jpg","01/15/2016","01/15/2016",,"Retirees Move or Not Stay or Go",,
"Downsizing_home.jpg","01/15/2016","01/15/2016",,"Downsizing",,
"Best_Cities_Healthcare_Workers.jpg","01/15/2016","01/15/2016",,,,
"rsz_rapidcity.jpg","01/17/2016","01/17/2016","wikipedia.org",,"Rapid City skyline","Rapid City"
"RockwellCollins.jpg","01/19/2016","01/19/2016",,"Front Desk at Rockwell Collins in Cedar Rapids, IA",,"Cedar Rapids"
"Indianapolis-Skyline-Daytime.jpg","01/20/2016","01/20/2016","Courtesy of Lavengood Photography","Downtown Indianapolis","As seen from the Central Canal in White River State Park.",
"Indianapolis-Motor-Speedway.jpg","01/20/2016","01/20/2016","Courtesy of the Indianapolis Motor Speedway",,,
"Downtown-Springfield.jpg","01/20/2016","01/20/2016","Courtesy of springfieldmo.org","Downtown Springfield, MO",,
"Ames_ISU_footbal.jpg","06/25/2017","01/20/2016","Courtesy of SD Dirk under a  CC 4.0  license.","Football payers on the offensive line for the Iowa State Cyclones",,"Ames"
"Cameron Watson-New York2.jpg","01/20/2016","01/20/2016",,,,
"Downtown Beaumont-Flickr.jpg","01/20/2016","01/20/2016","Courtesy of Ronnie Vonner under a  CC 4.0  license.","Downtown Beaumont",,"Beaumont"
"Lamar Cardinals-courtesy of Lamar University Athletics.jpg","01/20/2016","01/20/2016","courtesy of Lamar University Athletics","Lamar University Cardinals",,"Beaumont"
"Texas Energy Museum-courtesy of Beaumont CVB.jpg","01/20/2016","01/20/2016","courtesy of the Beaumont CVB","Texas Energy Museum",,"Beaumont"
"Willy Burger.jpg","01/20/2016","01/20/2016","courtesy of Willy Burger","Famous 'Booty Burger'",,"Beaumont"
"Oaks Historic District-courtest of Oaks Historic District.jpg","01/20/2016","01/20/2016","courtesy of Oaks Historic District","Homes in Oaks Historic District",,"Beaumont"
"SOST-courtesy of Beaumont CVB.jpg","01/20/2016","01/20/2016","courtesy of the Beaumont CVB","Symphony of Southeast Texas",,"Beaumont"
"Botanical Gardens-courtesy of the Beaumont Botanical Gardens.jpg","01/20/2016","01/20/2016","courtesy of the Beaumont Botanical Gardens","Beaumont Botanical Gardens",,"Beaumont"
"Community Players.jpg","01/20/2016","01/20/2016","Courtesy of Thomas Hallr for the Betty Greenberg Center For The Performing Arts.","Beaumont Community Players",,"Beaumont"
"Neches River-courtesy Beaumont CVB.jpg","05/16/2017","01/20/2016","Courtesy of the Beaumont CVB","Neches River",,"Beaumont"
"10_Affordable_Cities_Bloomington.jpg","01/21/2016","01/21/2016",,,,
"9_Affordable_Cities_Holland.jpg","01/21/2016","01/21/2016",,"2016 Best Affordable Places to Live - Holland",,
"8_Affordable_Cities_Cedar_Rapids.jpg","01/21/2016","01/21/2016",,"2016 Best Affordable Places to Live - Cedar Rapids",,
"7_Affordable_Cities_Greeley.jpg","01/21/2016","01/21/2016",,"2016 Best Affordable Places to Live - Greeley",,
"6_Affordable_Cities_Provo.jpg","01/21/2016","01/21/2016",,"2016 Best Affordable Places to Live - Provo",,
"5_Affordable_Cities_Sioux_Falls.jpg","01/21/2016","01/21/2016",,"2016 Best Affordable Places to Live - Sioux Falls",,
"4_Affordable_Cities_Round_Rock.jpg","01/21/2016","01/21/2016",,"2016 Best Affordable Places to Live - Round Rock",,
"3_Affordable_Cities_Rochester.jpg","01/21/2016","01/21/2016",,"2016 Best Affordable Places to Live - Rochester",,
"2_Affordable_Cities_Bismarck.jpg","01/21/2016","01/21/2016",,"2016 Best Affordable Places to Live - Bismarck",,
"1_Affordable_Cities_Huntsville.jpg","01/21/2016","01/21/2016",,"2016 Best Affordable Places to Live - Huntsville",,
"Paddle boarding_72.jpg","08/22/2017","01/25/2016",,,,
"DSC_0014-002.jpg","08/22/2017","01/25/2016",,,,
"sit2_vw_2.png","01/25/2016","01/25/2016",,,,
"madison.jpg","01/26/2016","01/26/2016",,"madison wisconsin",,
"8220814MJC0338.jpg","01/27/2016","01/27/2016","Michael Conti","Children gather at a small amphitheater at Huber Park in Shakopee, MN for an outdoor class.","Children during a summer class in an outdoor amphitheater at Huber Park in Shakopee, Minnesota, Scott County.","Shakopee"
"8220814MJC2084.jpg","01/27/2016","01/27/2016","Michael Conti","Seafood Cioppino at Perron's Sul Lago in Prior Lake, MN","A dish of cioppino served at Perron's Sul Lago restaurant in Prior Lake, MN.","Shakopee"
"Affordable_Cities_Graphic.jpg","01/27/2016","01/27/2016",,"2016 Top 10 Affordable Places to Live",,
"8221015MDT3406.jpg","01/27/2016","01/27/2016","Michael D. Tedesco","A couple stands in front of their new home in Shakopee, MN. The house has tan siding and red accents with white trim and garage doors.","Erik and Laura Doerr chose to purchase their new home in Shakopee, MN because of it's affordability and easy access to Downtown Minneapolis and surrounding areas.","Shakopee"
"8221015MDT3974.jpg","01/27/2016","01/27/2016","Michael D. Tedesco","A bartender poses behind the bar at Badger Hill Brewery.","Mark Sondreal a bartender at Badger Hill Brewery, 4571 Valley Industrial Blvd. S., Shakopee, MN","Shakopee"
"20questions.jpg","07/07/2016","07/07/2016","Courtesy of Michael Matti Photography",,"Thinking of moving? Here are twenty questions to ask about your new city. Will it help you lead the life you want?",
"Florida palm trees.jpg","01/29/2016","01/29/2016",,,,
"WhatSuperBowlCityIsBetter.jpg","01/29/2016","01/29/2016",,"Best Super Bowl City",,
"DH16 Back Exterior.jpg","01/29/2016","01/29/2016","Courtesy of HGTV","The back view from the water of the HGTV Dream Home.",,"Merritt Island"
"8070814BM9332-660x400.jpg","07/30/2017","01/29/2016","Brian McCord",,,"Portland"
"69009SUB050bannercrop.jpg","01/29/2016","01/29/2016","Courtesy of CRAIG HACKER PHOTOGRAPHY","INTRUST Bank Arena, Wichita, KS",,"Wichita"
"caucus.jpg","01/29/2016","01/29/2016",,"What's it like to live in a caucus state?",,
"iStock_000046178564web.jpg","06/14/2017","01/29/2016","Stock",,"Grain","Montana"
"Dollarphotoclub_66296245-740x493.jpg","06/28/2017","01/29/2016","Dollar Photo Club","Arkansas",,"Arkansas"
"BeerDollarphotoclub_78661392.jpg","06/27/2017","01/29/2016","Dollar Photo Club",,"beer",
"1521013JWA8304.jpg","07/30/2017","01/29/2016","Jeff Adkins",,,"Indianapolis"
"151SUBCOE024.CROP_.jpg","08/22/2017","01/29/2016","Submitted","The annual Wooden Boat Festival takes place each year in downtown Coeur d'Alene, Idaho.","The annual Wooden Boat Festival takes place each year in downtown Coeur d'Alene, Idaho.","Coeur d'Alene"
"Cedar Rapids on Fourth of July 2014-BlueRootsPhotography.jpg","01/29/2016","01/29/2016","Courtesy of BlueRootsPhotography","Cedar Rapids on the Fourth of July",,"Cedar Rapids"
"Bethesda_MD_Instagram_overlay.jpg","02/01/2016","02/01/2016","PHOTO CREDIT: Instagram sophe89","Bethesda MD is a Best Place to Live",,"Bethesda"
"Manchester-NHoverlay.jpg","02/03/2016","02/03/2016","Instagram cke_photo","Reasons to Move to Manchester NH",,"Manchester"
"2015_Family_Cities.jpg","02/02/2016","02/02/2016",,"2015 Best Cities for Families",,
"10TemporaryHousingTips.jpg","02/02/2016","02/02/2016",,"10 Tips for Temporary Housing",,
"New Jersey.jpg","03/09/2017","02/03/2016","Courtesy of Jason Jenkins under a  CC 4.0  license.","Nice snow scene on a hillside",,"New Jersey"
"Missouri.jpg","03/03/2017","02/03/2016","Courtesy of Joe Penniston under a  CC 4.0  license.","Panoramic night shot of Busch Stadiium in St. Louis",,"St. Louis"
"Nevada.jpg","03/09/2017","02/03/2016","Courtesy of Thomas Hawk under a  CC 4.0  license.","Shot of a roulette table along the Las Vegas Strip",,"Nevada"
"3060510jso9972-2.jpg","02/03/2016","02/03/2016","Jeff Otto","A girl swings on the monkey bars at Treehouse Playground in Fairview","Treehouse Playground at Bowie Nature Park is a popular place for children and adults in Fairview, TN.","Fairview"
"Michigan.jpg","03/09/2017","02/03/2016","Courtesy of Ankur Sohoni under a  CC 4.0  license.","The basketball arena at the University of Michigan",,"Michigan"
"Massachusetts.jpg","03/09/2017","02/03/2016","Courtesy of Roger under a  CC 4.0  license.","Nice architecture of a building on the campus of Harvard University",,"Massachusetts"
"Boston","08/22/2017","02/03/2016","Courtesy of Bert Kaufmann under a  CC 4.0  license.","Boston",,"Boston"
"Massachusetts.jpg","05/23/2017","02/03/2016","Courtesy of ephian under a  CC 4.0  license.","Panoramic view of Fenway Park",,"Massachusetts"
"Franklin_TN_Mars_Pet_Care.jpg","08/10/2016","08/10/2016","Jeff Otto","Franklin TN Business: Mars Pet Care","Mars Pet Care in Franklin, TN allows and encourages employees to bring their dogs to the office.","Franklin"
"Franklin_TN_Granite_City_Brewery.jpg","08/10/2016","08/10/2016","Brian McCord","Franklin TN Restaurant: Granite City Brewery","Outdoor dining at Granite City Food and Brewery in Franklin, TN.","Franklin"
"Franklin_TN_Harlinsdale_Park.jpg","08/10/2016","08/10/2016","Jeff Otto","Franklin TN Harlinsdale Park",,"Franklin"
"Franklin_TN_Saint_Thomas_Heart_Center.jpg","08/10/2016","08/10/2016","Wendy Jo O'Barr","Franklin TN Health Saint Thomas Heart Center",,"Franklin"
"Texas","03/09/2017","02/04/2016","Courtesy of Dave Wilson under a  CC 4.0  license.","excellent shot of the capital building in Austin",,"Texas"
"Detroit.jpg","03/30/2017","02/04/2016","Courtesy of Blue Skyz Studios under a  CC 4.0  license.","skyline of downtown Detroit along the Detroit River",,"Detroit"
"Texas things","02/04/2016","02/04/2016","Courtesy of Kenneth Lu under a  CC 4.0  license.","the Mission Contriol command center in Houston",,"Texas"
"Vermont_skiing.jpg","05/08/2017","02/04/2016","Courtesy of Christopher Schmidt under a  CC 4.0  license.","two cross-country snow skiers in Vermont",,"Vermont"
"Vermont.jpg","03/09/2017","02/04/2016","Courtesy of Nicholas Erwin under a  CC 4.0  license.","two people in a rowboat in an autumn setting",,"Vermont"
"MovingFromSouthtoNorth.jpg","02/05/2016","02/05/2016",,"Moving South to North",,
"ThingstoDoWaco.jpg","02/05/2016","02/05/2016",,"Things to Do in Waco TX",,
"anaheim-CA.jpg","02/05/2016","02/05/2016",,"Things to Do in Anaheim California",,"Anaheim"
"roundrock.jpg","02/05/2016","02/05/2016",,"Round Rock Texas",,"Round Rock"
"Affordable_Housing.jpg","02/08/2016","02/08/2016",,"Cheaper City",,
"151-Middleton-GwyStation111.jpg","02/08/2016","02/08/2016","city of Middleton, WI","People mill around the Greenway Station Shopping Center in Middleton, WI","Greenway Station Shopping Center in Middleton, WI is a popular gathering place.","Middleton"
"Move-Away.jpg","02/09/2016","02/09/2016",,"Moving Away from Family",,
"drugs.jpg","02/09/2016","02/09/2016",,"Stock art of vials and a syringe.",,
"151-Middle-creamDSC_0449.jpg","02/09/2016","02/09/2016","city of Middleton, WI","A woman buys something from the Bloom Bake Shop in Downtown Middleton","Bloom Bake Shop in Downtown Middleton, WI.","Middleton"
"Returning_To_US.jpg","02/09/2016","02/09/2016",,"Returning to the US",,
"Mission Health (for front cover).png","03/10/2017","02/09/2016",,,,
"BusinessClimate_logo2015.jpg","02/09/2016","02/09/2016",,,,
"morningaugusta.jpg","02/09/2016","02/09/2016","courtesy of Visit Augusta","A crew team paddles across the river as the sun rises over the city of Augusta, GA.","A crew team floats down the Savannah River as the sun rises over Augusta, GA.","Augusta"
"151-hend-tn-flickr-football.jpg","02/10/2016","02/10/2016","Courtesy of CJ Sorg under a  CC 4.0  license.","The Hendersonville Commandos football team scrimmages","Hendersonville football team scrimmage.","Hendersonville"
"151-hend-tn-insta-duck.jpg","02/10/2016","02/10/2016","courtesy of Melissa Hurt","A white duck swims towards an orange sunset on Old Hickory Lake","Old Hickory Lake","Hendersonville"
"151-hend-tn-flickr-mont.jpg","02/10/2016","02/10/2016","Courtesy of Brent Moore under a  CC 4.0  license.","Monthaven in Hendersonville, TN","Monthaven in Hendersonville, TN","Hendersonville"
"hend-banner.jpg","02/10/2016","02/10/2016","Melissa Hurt",,,"Hendersonville"
"151-middle-flick-flowers.jpg","02/10/2016","02/10/2016","Courtesy of Joshua Mayer under a  CC 4.0  license.","A girl walks through acres of sunflowers on Pope Farm.","A girl walks through a acres of sunflowers in Middleton, WI.","Middleton"
"Irvine.jpg","07/26/2017","02/11/2016","Courtesy of Maziar Hooshmand under a  CC 4.0  license.","Neighborhood with Irvine skyline in background",,"Irvine"
"80603SUB011.jpg","02/11/2016","02/11/2016",,"A man on horseback looks over the mountains at the Caribou-Targhee Forest.","The Caribou-Targhee National Forest is just a couple hours away from Pocatello, making it an ideal spot for day trip.","Pocatello"
"8060913WJO8060913.jpg","02/11/2016","02/11/2016","Wendy Jo O'Barr","A view of Holt Arena on the Idaho State University Campus with a mountain the background.","Holt Arena, on Idaho State University campus, hosts many sporting events in the Pocatello area.","Pocatello"
"80603SUB071.jpg","02/11/2016","02/11/2016","Courtesy of Amy's Kitchen",,,"Pocatello"
"80603SUB062.jpg","02/11/2016","02/11/2016","Brandon Caldwell","A man paddleboards at the Portneuf Wellness Complex, while many people wade in the water and watch from the beach.","Portneuf Wellness Complex","Pocatello"
"IMG_1047-2 (2)-crop.jpg","02/12/2016","02/12/2016","courtesy of city of Covington, TN","Courthouse in Covington, TN",,"Covington"
"blow_pop.jpg","02/12/2016","02/12/2016",,"Charms Blow Pops","Charms Blow Pops and other candies are made in Covington, TN.","Covington"
"pulledpork.jpg","02/15/2016","02/15/2016","Courtesy of Sarah Rose under a  CC 4.0  license.","Pulled pork in a red bowl.","Paleo Pulled Pork",
"BusinessClimate_logo2015.png","02/15/2016","02/15/2016",,,,
"Top10_FoodieCities_2014.png","02/13/2017","02/16/2016",,,,
"Top10_FoodieCities_2012.png","02/16/2016","02/16/2016",,"Top 10 Foodie Cities 2012",,
"Hometown Junction Farmers Market-crop.jpg","02/16/2016","02/16/2016","courtesy of the city of Verona, WI","People gather around the Hometown Junction Farmers Market in Verona, WI.","Hometown Junction Farmers Market, Verona, WI.","Verona"
"Hometown Junction Farmers Market-crop_edited-1.jpg","02/16/2016","02/16/2016","courtesy of city of Verona, WI","People gather around the Hometown Junction Farmers Market in Verona, WI.","Hometown Junction Farmers Market","Verona"
"WisconsinBrewing.jpg","02/16/2016","02/16/2016","courtesy of the city of Verona, WI","People walk to and from Wisconsin Brewing Co. in Verona.","People sit on the grass and walk to and from Wisconsin Brewery in the city of Verona.","Verona"
"beach2-splash-XL-crop.jpg","02/16/2016","02/16/2016","photo by Samantha Christian/Verona Press","A boy falls backwards into a lake as children behind him play on an inflatable raft and other swim.","The 15th Annual Verona Beach Bash drew more than 430 people to Fireman's Park Beach.","Verona"
"ziplineinasheboro-crop.jpg","02/16/2016","02/16/2016","Todd Bennett","The silhouette of a person can be seen in front of a setting sun as he ziplines through trees.",,"Asheboro"
"Mississippi.jpg","03/09/2017","02/17/2016","Courtesy of  James Hill  under a  CC 4.0  license.","steamboat photo in Mississippi",,"Mississippi"
"Montana","02/17/2016","02/17/2016","Courtesy of  Isolino Ferreira  under a  CC 4.0  license.","shining view of the sky",,"Montana"
"plano tx.jpg","03/02/2016","03/02/2016","Courtesy of Stylepinner under a  CC 4.0","Plano, Texas","Plano, Texas","Plano"
"Beach Pier-crop.jpg","02/19/2016","02/19/2016","courtesy of city of Verona, WI","People fish off the pier at Verona Beach in Verona, WI","Fishing on the pier at Verona Beach.","Verona"
"Making_Military_Move.jpg","02/22/2016","02/22/2016",,"How to Make a Military Move",,
"IrishSmallTowns.jpg","02/22/2016","02/22/2016",,"Most Surprising Irish Small Towns",,
"NorthCarolina_Affordable_Cities.jpg","02/22/2016","02/22/2016",,"North Carolina Affordable Cities",,
"Florida_Affordable_Cities.jpg","02/22/2016","02/22/2016",,"Florida Affordable Cities",,
